intent,expression
payments.question.how.cancel.transaction,ik wil een recente transactie annuleren kan je mij tonen stap per stap hoe het moet
payments.question.how.cancel.transaction,ik wil een transactie intrekken en had graag geweten hoe het werk
payments.question.how.cancel.transaction,Ik wil mijn verrichting stoppen met hoe het
payments.question.how.cancel.transaction,Ik zou een verrichting willen annuleren op de bankrekening Belfius hoe moet het
payments.question.how.cancel.transaction,kan je me vertellen hoe ga ik tewerk om een verrichting te laten schrappen
payments.question.how.cancel.transaction,kan je me zeggen hoe ik een verrichting kan intrekken
payments.question.how.cancel.transaction,kan je mij vertellen hoe ik een verrichting ongedaan maak
payments.question.how.cancel.transaction,kan je mij zeggen hoe ik een transactie annuleer
payments.question.how.cancel.transaction,wat moet ik doen als ik een verrichting wil ongedaan maken
payments.question.how.cancel.transaction,wat moet ik doen om een transactie te annuleren
payments.question.how.cancel.transfer,hoe annuleer ik een overschrijving die ik reeds getekend heb
payments.question.how.cancel.transfer,hoe kan ik de laatste overschrijving terughalen
payments.question.how.cancel.transfer,hoe kan ik een geldoverdracht annuleren
payments.question.how.cancel.transfer,hoe kan ik een herroeping van de overschrijving doen
payments.question.how.cancel.transfer,hoe kan ik een overschrijving intrekken
payments.question.how.cancel.transfer,hoe kan ik een overschrijving tenietdoen
payments.question.how.cancel.transfer,hoe kan je een overschrijving wissen
payments.question.how.cancel.transfer,hoe schrap ik een overschrijving
payments.question.how.cancel.transfer,hoe stop ik een overschrijving
payments.question.how.cancel.transfer,ik wil weten hoe ik een overschrijving kan annuleren
payments.question.how.cancel.transfer,ik zou graag willen weten hoe ik mijn overschrijving kan annuleren
payments.question.how.cancel.transfer,kan je me zeggen hoe ik een overschrijving kan intrekken
payments.question.how.cancel.transfer,kan je mij vertellen hoe ik een overschrijving ongedaan maakt
payments.question.how.cancel.transfer,kan je mij zeggen hoe ik een overschrijving annuleer
payments.question.how.cancel.transfer,kan jij mij vertellen hoe ik een overschrijving annuleer
payments.question.how.cancel.transfer,kunt u mij vertellen wat ik moet doen om een overschrijving te annuleren
payments.question.how.cancel.transfer,wat moet ik doen als ik een overschrijving wil ongedaan maken
payments.question.how.cancel.transfer,wat moet ik doen om een overschrijving ongedaan te maken
payments.question.how.cancel.transfer,wat moet ik doen om een overschrijving te laten ontbinden
payments.question.how.cancel.transfer,welke stappen moet ik volgen om een overschrijving te annuleren
payments.report.execute.transfer.error,fout bij het uitvoeren van een overdracht
payments.report.execute.transfer.error,fout bij overschrijving
payments.report.execute.transfer.error,foutieve overschrijving ingegeven
payments.report.execute.transfer.error,heb een overschrijving gedaan die niet klopt
payments.report.execute.transfer.error,heb een verkeerd bedrag doorgegeven voor mijn overschrijving
payments.report.execute.transfer.error,heb fout gemaakt bij een overschrijving
payments.report.execute.transfer.error,ik betaalde te veel aan iemand met een overschrijving
payments.report.execute.transfer.error,ik deed een fout bij het ingeven van een overschrijving
payments.report.execute.transfer.error,ik deed een foute overschrijving
payments.report.execute.transfer.error,Ik heb een fout gemaakt tijdens een overdracht
payments.report.execute.transfer.error,ik heb een foute overdracht gedaan
payments.report.execute.transfer.error,ik heb een verkeerde overschrijving gedaan
payments.report.execute.transfer.error,ik heb een verkeerde overschrijving uitgevoerd
payments.report.execute.transfer.error,ik heb me vergist bij een overschrijving
payments.report.execute.transfer.error,ik heb per ongeluk een overschrijving gevoerd
payments.report.execute.transfer.error,ik maakte een foutieve overschrijving
payments.report.execute.transfer.error,ongeregeldheid bij het uitvoeren van een overschrijving
payments.report.execute.transfer.error,vergissing gemaakt tijdens uitvoering van een overdracht
payments.report.execute.transfer.error,verkeerde overschrijving
payments.report.execute.transfer.error,verkeerde overschrijving geboekt
payments.report.execute.transfer.error,verkeerde overschrijving gedaan
payments.request.cancel.payment,annulatie betaling
payments.request.cancel.payment,annuleer een betaling
payments.request.cancel.payment,betaling aflasten
payments.request.cancel.payment,betaling cancelen
payments.request.cancel.payment,betaling schrappen
payments.request.cancel.payment,betaling tenietdoen
payments.request.cancel.payment,betaling terugroepen
payments.request.cancel.payment,betaling van gisteren afschaffen
payments.request.cancel.payment,betaling verwijderen
payments.request.cancel.payment,een betaling herroepen
payments.request.cancel.payment,er is een betaling die ik wil schrappen
payments.request.cancel.payment,ik ben van gedachten verandert en  ik wil de annulatie van een betaling doen
payments.request.cancel.payment,ik had graag mijn betaling geannuleerd
payments.request.cancel.payment,ik heb een betaling gedaan en wil die graag annuleren
payments.request.cancel.payment,ik moet een betaling tegenhouden
payments.request.cancel.payment,ik wens een betaling te verwijderen
payments.request.cancel.payment,ik wil dat je een betaling annuleert
payments.request.cancel.payment,ik wil dat je een betaling intrekt
payments.request.cancel.payment,ik wil een betaling schrappen
payments.request.cancel.payment,ik wil graag een betalng herroepen
payments.request.cancel.payment,ik wil mijn betaling intrekken
payments.request.cancel.payment,ik wil mijn betaling verwijderen
payments.request.cancel.payment,ik zou een betaling willen intrekken
payments.request.cancel.payment,recente betaling annuleren
payments.request.cancel.transaction,annulatie van transactie verrichten
payments.request.cancel.transaction,annulatie verrichting
payments.request.cancel.transaction,annuleren transactie
payments.request.cancel.transaction,deze transactie mag dus niet gebeuren
payments.request.cancel.transaction,een transactie annuleren
payments.request.cancel.transaction,help mij met een verrichting terug te roepen
payments.request.cancel.transaction,ik had graag mijn transactie geannuleerd
payments.request.cancel.transaction,ik wil dat je een transactie annuleert
payments.request.cancel.transaction,ik wil de annulatie van een ingevoerde verrichting doen
payments.request.cancel.transaction,ik wil een transactie intrekken
payments.request.cancel.transaction,ik wil een transactie schrappen
payments.request.cancel.transaction,ik wil een verrichting ongedaan krijken
payments.request.cancel.transaction,ik wil graag dat je mijn laatste verrichting annuleert
payments.request.cancel.transaction,ik wil graag een verrichting herroepen
payments.request.cancel.transaction,ik wil mijn verrichting van gisteren annuleren
payments.request.cancel.transaction,ik zou een verrichting willen annuleren
payments.request.cancel.transaction,kan je een transactie laten annuleren
payments.request.cancel.transaction,kan je een transactie tegenhouden
payments.request.cancel.transaction,kan je een transactie van gisteren alsnog annuleren
payments.request.cancel.transaction,kan jij mijn verrichting nog tegenhouden
payments.request.cancel.transaction,transactie schrappen
payments.request.cancel.transaction,transactie tenietdoen
payments.request.cancel.transaction,verrichting aflasten
payments.request.cancel.transaction,verrichting tenietdoen
payments.request.cancel.transfer,Annulatie ingevoerde overschrijving
payments.request.cancel.transfer,annuleren overschrijving
payments.request.cancel.transfer,de overdracht dat ik heb net ingegeven moet geannuleerd worden
payments.request.cancel.transfer,deze overschrijving mag dus niet gebeuren
payments.request.cancel.transfer,door omstandigheden kan een overschrijving zonder datum niet doorgaan en moet die nu laten wissen
payments.request.cancel.transfer,een overdracht moet geschrapt worden
payments.request.cancel.transfer,genoteerde overschrijvingen annuleren
payments.request.cancel.transfer,graag annulatie van een overschrijving
payments.request.cancel.transfer,graag mijn overschrijving annuleren
payments.request.cancel.transfer,heb een kwartiertje geleden een overschrijving ingevoerd dit ik graag terug zou annuleren
payments.request.cancel.transfer,ik ben van gedachten verandert en  ik wil de annulatie van overschrijving doen
payments.request.cancel.transfer,ik had graag mijn overschrijving geannuleerd
payments.request.cancel.transfer,ik heb een overschrijving ingevoerd maar ik wil die overschrijving tegenhouden
payments.request.cancel.transfer,ik moet een overschrijving tegenhouden
payments.request.cancel.transfer,ik wil dat je een overschrijving annuleert
payments.request.cancel.transfer,Ik wil de gedane overschrijvingen wissen
payments.request.cancel.transfer,ik wil graag een overschrijving herroepen
payments.request.cancel.transfer,ik wil mijn overschrijving wissen
payments.request.cancel.transfer,ik zou een overschrijving willen annuleren
payments.request.cancel.transfer,kan belfius die overschrijving laten annuleren
payments.request.cancel.transfer,overdracht moet geannuleerd worden
payments.request.cancel.transfer,overschrijving afbreken
payments.request.cancel.transfer,overschrijving tegenhouden
payments.request.cancel.transfer,overschrijving tenietdoen
payments.request.cancel.transfer,overschrijving zonder datum annuleren
smalltalk.appraisal.thank_you,bedankt
smalltalk.appraisal.thank_you,bedankt u was een grote hulp
smalltalk.appraisal.thank_you,bedankt voor de informatie
smalltalk.appraisal.thank_you,cool thanks
smalltalk.appraisal.thank_you,dank
smalltalk.appraisal.thank_you,dank je
smalltalk.appraisal.thank_you,dank je voor de info
smalltalk.appraisal.thank_you,dank je wel
smalltalk.appraisal.thank_you,dank u voor uw hulp
smalltalk.appraisal.thank_you,dank u wel voor de info
smalltalk.appraisal.thank_you,dank u zeer
smalltalk.appraisal.thank_you,enorm bedankt
smalltalk.appraisal.thank_you,fantastisch bedankt
smalltalk.appraisal.thank_you,fantastisch dank je
smalltalk.appraisal.thank_you,geweldig bedankt
smalltalk.appraisal.thank_you,hartelijk bedankt
smalltalk.appraisal.thank_you,hartelijk dank
smalltalk.appraisal.thank_you,heel fel bedankt
smalltalk.appraisal.thank_you,heel hartelijk bedankt
smalltalk.appraisal.thank_you,je hebt me flink geholpen bedankt
smalltalk.appraisal.thank_you,merciekes
smalltalk.appraisal.thank_you,mercikes
smalltalk.appraisal.thank_you,nogmaals bedankt
smalltalk.appraisal.thank_you,ok bedankt voor uw snelle antwoord
smalltalk.appraisal.thank_you,ok dankjewel
smalltalk.appraisal.thank_you,ok merci
smalltalk.appraisal.thank_you,okay bedankt
smalltalk.appraisal.thank_you,oke super merci
smalltalk.appraisal.thank_you,thanks
smalltalk.appraisal.thank_you,thx
smalltalk.greetings.goodbye,bye bye
smalltalk.greetings.goodbye,cu
smalltalk.greetings.goodbye,de groeten en tot binnenkort
smalltalk.greetings.goodbye,doei
smalltalk.greetings.goodbye,en tot later
smalltalk.greetings.goodbye,fijn weekend
smalltalk.greetings.goodbye,fijne dag
smalltalk.greetings.goodbye,fijne ochtend nog
smalltalk.greetings.goodbye,goed weekend
smalltalk.greetings.goodbye,goede avond
smalltalk.greetings.goodbye,goei weekend botje
smalltalk.greetings.goodbye,het was me een genoegen
smalltalk.greetings.goodbye,nee ik ga slapen nu tot later
smalltalk.greetings.goodbye,nog een fijne dag
smalltalk.greetings.goodbye,ok tot later dan
smalltalk.greetings.goodbye,oke ciao
smalltalk.greetings.goodbye,oke goedenavond
smalltalk.greetings.goodbye,ook voor u nog een fijne avond
smalltalk.greetings.goodbye,prettige avond nog verder
smalltalk.greetings.goodbye,salut
smalltalk.greetings.goodbye,saluukes
smalltalk.greetings.goodbye,slaap wel
smalltalk.greetings.goodbye,slaapwel
smalltalk.greetings.goodbye,stop conversatie
smalltalk.greetings.goodbye,tot de volgende keer
smalltalk.greetings.goodbye,tot later
smalltalk.greetings.goodbye,tot morgen
smalltalk.greetings.goodbye,tot straks
smalltalk.greetings.goodbye,tot ziens
smalltalk.greetings.hello,allo
smalltalk.greetings.hello,beste bot
smalltalk.greetings.hello,dag beste
smalltalk.greetings.hello,dag meneer bot
smalltalk.greetings.hello,dag vriend
smalltalk.greetings.hello,gegroet
smalltalk.greetings.hello,goedemiddag
smalltalk.greetings.hello,goedemorgen
smalltalk.greetings.hello,goedenavond
smalltalk.greetings.hello,goedendag meneer of mevrouw
smalltalk.greetings.hello,goeie morgen
smalltalk.greetings.hello,goeieavond bbot
smalltalk.greetings.hello,goeiedag
smalltalk.greetings.hello,goeiemorgen
smalltalk.greetings.hello,hallo
smalltalk.greetings.hello,heel goede middag
smalltalk.greetings.hello,hello
smalltalk.greetings.hello,hey belfius
smalltalk.greetings.hello,hey hoe is het met jou bbot
smalltalk.greetings.hello,hi
smalltalk.greetings.hello,hoi
smalltalk.greetings.hello,hoy
smalltalk.greetings.hello,is er iemand
smalltalk.greetings.hello,middag
smalltalk.greetings.hello,yo salukes
smalltalk.greetings.hello,hoi daar bbot
smalltalk.user.no_help_needed,alles is opgelost
smalltalk.user.no_help_needed,chat niet nodig
smalltalk.user.no_help_needed,desnoods ga ik straks zelf wel langs het kantoor
smalltalk.user.no_help_needed,geen andere vraag ik zal mij tot het kantoor wenden
smalltalk.user.no_help_needed,geen collega inschakelen
smalltalk.user.no_help_needed,geen medewerker nodig
smalltalk.user.no_help_needed,geen verdere vragen voorlopig
smalltalk.user.no_help_needed,geen vraag meer
smalltalk.user.no_help_needed,het is al geregeld met de bank zelf
smalltalk.user.no_help_needed,het is al in orde
smalltalk.user.no_help_needed,het is gelukkig in orde gekomen dank je wel
smalltalk.user.no_help_needed,het is goed zo
smalltalk.user.no_help_needed,ik heb geen vragen momenteel
smalltalk.user.no_help_needed,ik hoef geen collega
smalltalk.user.no_help_needed,ik weet het antwoord al
smalltalk.user.no_help_needed,ik zal wel naar de bank zelf gaan
smalltalk.user.no_help_needed,is niet meer nodig
smalltalk.user.no_help_needed,je collega moet me niet meer contacteren ik bel morgen zelf met mijn bank
smalltalk.user.no_help_needed,je moet niemand zoeken voor me
smalltalk.user.no_help_needed,laat maar heb het gevonden
smalltalk.user.no_help_needed,nee dat hoeft niet
smalltalk.user.no_help_needed,nee het is goed
smalltalk.user.no_help_needed,nee het is ok
smalltalk.user.no_help_needed,nee hoeft niet meer
smalltalk.user.no_help_needed,nee ik heb verder geen vragen
smalltalk.user.no_help_needed,nee laat maar zitten
smalltalk.user.no_help_needed,neen ik vraag het wel in het kantoor
smalltalk.user.no_help_needed,niet nodig om een collega te roepen
smalltalk.user.no_help_needed,niets meer u heeft op al mijn vragen een antwoord gegeven
unspecified.question.change.limit,ben je zeker dat de limiet anders kan zijn
unspecified.question.change.limit,is het mogelijk om de limiet te wijzigen
unspecified.question.change.limit,kan een limiet gewijzigd worden
unspecified.question.change.limit,kan er iemand mijn limiet veranderen
unspecified.question.change.limit,kan er iemand mijn reserve veranderen
unspecified.question.change.limit,kan het limiet gemodificeerd worden
unspecified.question.change.limit,kan iedereen de limiet veranderen
unspecified.question.change.limit,kan ik de limiet changeren
unspecified.question.change.limit,kan ik de limiet wijzigen
unspecified.question.change.limit,kan ik mijn limiet aanpassen
unspecified.question.change.limit,kan ik mijn limiet hier wijzigen
unspecified.question.change.limit,kan ik mijn limiet ook zelf bijstellen
unspecified.question.change.limit,kan ik mijn limiet wijzigen
unspecified.question.change.limit,kan ikzelf de limiet laten veranderen
unspecified.question.change.limit,Kan je mij helpen met mijn limiet  aan te passen
unspecified.question.change.limit,tot welk bedrag kan ik mijn limiet veranderen
unspecified.question.change.limit,kan de limiet gewijzigd worden
unspecified.question.change.limit,kan de limiet aangepast worden
unspecified.question.change.limit,kan ik een aanpassing uitvoeren op mijn limiet
unspecified.question.change.limit,kan ik een aanpassing doen aan de limiet
unspecified.question.how.change.limit,hoe kan ik de limieten aanpassen
unspecified.question.how.change.limit,hoe kan ik mijn gebruikslimiet aanpassen
unspecified.question.how.change.limit,hoe kan ik mijn limiet aanpassen
unspecified.question.how.change.limit,hoe kan ik mijn limiet veranderen
unspecified.question.how.change.limit,hoe kan ik mijn limiet wijzigen
unspecified.question.how.change.limit,hoe kan je het limiet veranderen
unspecified.question.how.change.limit,hoe kan men zijn limiet aanpassen
unspecified.question.how.change.limit,hoe pas ik mijn gebruikslimiet aan
unspecified.question.how.change.limit,hoe pas ik mijn maximale limiet aan
unspecified.question.how.change.limit,hoe verander ik de limiet
unspecified.question.how.change.limit,hoe wijzig ik mijn limiet
unspecified.question.how.change.limit,ik wil weten hoe ik de limiet kan veranderen
unspecified.question.how.change.limit,kan ik mijn limieten aanpassen en hoe moet ik dat doen
unspecified.question.how.change.limit,kan je mij laten zien hoe het moet om de bestedingslimiet te wijzigen
unspecified.question.how.change.limit,kan je mij tonen hoe het moet om limiet te  wijzigen
unspecified.question.how.change.limit,kan je mij tonen hoe ik de limiet kan veranderen
unspecified.question.how.change.limit,kan je mij tonen hoe je de limiet kan aanpassen
unspecified.question.how.change.limit,limiet moet anders zijn maar ik weet niet hoe kan je mij helpen
unspecified.question.how.change.limit,weet jij hoe limiet wijzigen
unspecified.question.how.change.limit,weet jij hoe moet ik de bestedingslimiet aanpassen
unspecified.question.how.raise.limit,als ik een hogere limiet wil hebben hoe moet ik dat doen
unspecified.question.how.raise.limit,hoe kan ik de standaarduitgavenlimiet verhogen
unspecified.question.how.raise.limit,hoe kan ik limiet verhogen
unspecified.question.how.raise.limit,Hoe kan ik mijn limiet laten verhogen
unspecified.question.how.raise.limit,hoe kan ik mijn limiet verhogen
unspecified.question.how.raise.limit,hoe kan ik standaardlimiet opdrijven
unspecified.question.how.raise.limit,hoe limiet verhogen
unspecified.question.how.raise.limit,Hoe Maximum bedrag verhogen
unspecified.question.how.raise.limit,hoe moet ik mijn limiet vermeerderen
unspecified.question.how.raise.limit,hoe verhoog ik mijn limiet
unspecified.question.how.raise.limit,hoe verhoog je je limiet
unspecified.question.how.raise.limit,hoeveel kan ik mijn limiet omhoog trekken
unspecified.question.how.raise.limit,hoeveel kan ik mijn limiet verhogen
unspecified.question.how.raise.limit,ik weet niet hoe ik mijn limiet kan verhogen kan je mij helpen
unspecified.question.how.raise.limit,ik zou graag willen weten hoe ik mijn limiet kan verhogen
unspecified.question.how.raise.limit,wat moet ik doen om mijn uitgavenlimiet te verhogen
unspecified.question.how.raise.limit,weet jij hoe ik mijn limiet kan vergroten
unspecified.question.how.raise.limit,weet jij hoe ik mijn limiet kan verhogen
unspecified.question.how.raise.limit,weet jij hoe ik mijn limiet zou kunnen verheffen
unspecified.question.how.raise.limit,wat moet ik doen om mijn limiet hoger te zetten
unspecified.question.how.raise.limit.phone,de limiet verhogen via de vaste lijn hoe moet het
unspecified.question.how.raise.limit.phone,hoe doe je het om vanaf vaste lijn mijn limiet omhoogtrekken
unspecified.question.how.raise.limit.phone,hoe kan ik limiet verhogen met vaste toestel
unspecified.question.how.raise.limit.phone,hoe kan ik per telefoon mijn limiet optrekken
unspecified.question.how.raise.limit.phone,hoe kan ik vanaf mijn telefoon de limiet vermeerderen
unspecified.question.how.raise.limit.phone,hoe kan ik via mijn telefoon de limiet verhogen
unspecified.question.how.raise.limit.phone,hoe moet het om vanaf mijn telefoon de limiet te verhogen
unspecified.question.how.raise.limit.phone,hoe moet ik mijn limiet verhogen vanaf mijn telefoon
unspecified.question.how.raise.limit.phone,hoe om  limiet te verhogen vanaf telefoon
unspecified.question.how.raise.limit.phone,hoe verhoog je telefonisch je limiet
unspecified.question.how.raise.limit.phone,hoe zet je de limiet omhoog via de telefoon
unspecified.question.how.raise.limit.phone,ik zou graag willen weten hoe ik via een vaste nummer de limiet kan verhogen
unspecified.question.how.raise.limit.phone,kan je mij tonen hoe het moet om de limiet te verhogen met de telefoon
unspecified.question.how.raise.limit.phone,telefonisch mijn limiet optrekken hoe moet dat
unspecified.question.how.raise.limit.phone,wat moet gedaan worden om telefonisch zelf je limiet te verhogen
unspecified.question.how.raise.limit.phone,wat moet ik doen om vanaf mijn telefoon mijn limiet te verhogen
unspecified.question.how.raise.limit.phone,weet jij hoe ik per telefoon mijn limiet kan optrekken
unspecified.question.how.raise.limit-time_duration.monthly,hoe kan ik mijn limiet verhogen deze maand
unspecified.question.how.raise.limit-time_duration.monthly,hoe kan ik mijn limiet voor deze maand optrekken
unspecified.question.how.raise.limit-time_duration.monthly,hoe kan ik mijn maandlimiet verhogen
unspecified.question.how.raise.limit-time_duration.monthly,hoe moet ik de limiet voor deze maand naar boven halen
unspecified.question.how.raise.limit-time_duration.monthly,Hoe moet ik de maandlimiet verhogen
unspecified.question.how.raise.limit-time_duration.monthly,hoe trek ik de maandlimiet omhoog
unspecified.question.how.raise.limit-time_duration.monthly,hoe verhoog ik de limiet voor deze maand
unspecified.question.how.raise.limit-time_duration.monthly,hoe zet ik de limiet voor deze maand omhoog
unspecified.question.how.raise.limit-time_duration.monthly,ik heb deze maand meer limiet nodig weet jij wat ik moet doen
unspecified.question.how.raise.limit-time_duration.monthly,ik heb mijn maandelijkse limiet bereikt maar vind niet hoe ik deze kan verhogen
unspecified.question.how.raise.limit-time_duration.monthly,ik heb niet genoeg met mijn limiet deze maand en ik wil ze verhogen hoe moet dat
unspecified.question.how.raise.limit-time_duration.monthly,ik weet niet hoe ik de limiet voor deze maand hoger moet zetten
unspecified.question.how.raise.limit-time_duration.monthly,ik zit vast met mijn maandlimiet hoe kan ik die verhogen
unspecified.question.how.raise.limit-time_duration.monthly,wat kan ik doen om mijn maandlimiet te verhogen
unspecified.question.how.raise.limit-time_duration.monthly,wat moet ik doen voor een hogere limiet te krijgen deze maand
unspecified.question.how.raise.limit-time_duration.monthly,wat moet ik doen want ik heb deze maand een hogere limiet nodig voor deze maand
unspecified.question.how.raise.limit-time_duration.monthly,ik wil de limiet verhogen voor deze maand hoe moet dat
unspecified.question.how.raise.limit-time_duration.monthly,ik wil deze maand een hogere limiet hoe doe ik dat
unspecified.question.lower.limit,bestaat de mogelijkheid de uitgavenlimiet te verkleinen
unspecified.question.lower.limit,ik wil weten of de limiet kan verlaagd worden
unspecified.question.lower.limit,is het mogelijk om de limiet te verlagen
unspecified.question.lower.limit,is het verlaging van de limiet toegestaan
unspecified.question.lower.limit,is mogelijk het limiet te verminderen
unspecified.question.lower.limit,kan de limiet naar beneden getrokken worden
unspecified.question.lower.limit,kan ik de uitgavenlimiet verkleineren
unspecified.question.lower.limit,kan ik het limiet kleiner maken
unspecified.question.lower.limit,kan ik mijn limiet ook verlagen
unspecified.question.lower.limit,kan ik mijn limiet veel lager maken
unspecified.question.lower.limit,kan ikzelf de limiet verlagen
unspecified.question.lower.limit,kan je mij vertellen over de vermindering van de uitgavenlimiet
unspecified.question.lower.limit,maar is het mogelijk om de limiet te minimiseren
unspecified.question.lower.limit,tot hoeveel euro kan de limiet verlagen
unspecified.question.lower.limit,tot welk bedrag kan de limiet lager getrokken worden
unspecified.question.lower.limit,tot welk bedrag kan ik de limiet reduceren
unspecified.question.lower.limit,wat is het minimum bedrag door de limiet te verlagen
unspecified.question.raise.limit,ik heb een hogere limiet nodig om meer te kunnen uitgeven wie kan die verhogen
unspecified.question.raise.limit,is het mogelijk om de limiet hoger te zetten
unspecified.question.raise.limit,kan de limiet zelf verhoogd worden
unspecified.question.raise.limit,kan die gebruikslimiet niet verhoogd worden
unspecified.question.raise.limit,kan het limiet verhoogd worden
unspecified.question.raise.limit,kan het maximum bedrag dag ik per dag kan uitgeven verhoogd worden
unspecified.question.raise.limit,kan ik deze limiet verhogen
unspecified.question.raise.limit,kan ik mijn limiet aan de maximum zetten
unspecified.question.raise.limit,kan ik mijn limiet verhogen
unspecified.question.raise.limit,kan ik mijn reserve verhogen
unspecified.question.raise.limit,kan je dat max bedrag ook verhogen
unspecified.question.raise.limit,kan je de limiet optrekken
unspecified.question.raise.limit,kan jij de limieten verhogen
unspecified.question.raise.limit,kan jij de maximum van mijn limiet omhoog trkken
unspecified.question.raise.limit,kun je het limiet omhoog zetten
unspecified.question.raise.limit,kun je mijn limiet verhogen
unspecified.question.raise.limit,tot welk bedrag kan ik mijn limiet maximaal optrekken
unspecified.question.raise.limit,wat als ik een hoger limiet nodig heb om meer te kunnen uitgeven
