intent,expression
cards.question.how_long.order.bankcard-creditcard,hoe lang duurt het om een kredietkaart aan te vragen
cards.question.how_long.order.bankcard-creditcard,hoe lang duurt het aanvrag van een mastercard gold
cards.question.how_long.order.bankcard-creditcard,hoe lang duurt het voor een aanvraag te doen voor een mastercard gold
cards.question.how_long.order.bankcard-creditcard,hoe lang duurt een aanvraag van een kredietkaart
cards.question.how_long.order.bankcard-creditcard,hoe lang duurt het bestelling van een kredietkaart
cards.question.how_long.order.bankcard-creditcard,hoe lang duurt het om een mastercard aan te vragen
cards.question.how_long.order.bankcard-creditcard,hoe lang duurt het om een mastercard gold aan te vragen
cards.question.how_long.order.bankcard-creditcard,hoe lang duurt het om een prepaid white aan te vragen
cards.question.how_long.order.bankcard-creditcard,hoe lang duurt het om een prepaid mastercard aan te vragen
cards.question.how_long.order.bankcard-creditcard,ik wil graag een kredietkaart aanvragen hoe lang duurt de aanvraag
cards.question.how_long.order.bankcard-creditcard,hoe lang duurt het aanvragen van een kredietkaart
cards.question.how_long.order.bankcard-creditcard,hoeveel dagen duurt het om een nieuwe prepaid-masterkaart aan te vragen
cards.question.how_long.order.bankcard-creditcard,hoe lang duurt mijn verzoek voor een nieuwe prepaidkaart
cards.question.how_long.order.bankcard-creditcard,hoe lang duurt de aanvraagprocedure voor een kredietkaart
cards.question.how_long.receive.bankcard,als ik een kaart aanvraag hoelang duurt het voor ik die ontvang
cards.question.how_long.receive.bankcard,binnen hoeveel dagen ontvang ik mijn kaart
cards.question.how_long.receive.bankcard,binnen hoeveel tijd ontvang ik mijn bankkaart
cards.question.how_long.receive.bankcard,binnen welke termijn zal ik mijn kaart ontvangen
cards.question.how_long.receive.bankcard,hoelang duurt het om uw kaart te ontvangen
cards.question.how_long.receive.bankcard,hoelang duurt het voordat mijn kaart bij het kantoor aankomt
cards.question.how_long.receive.bankcard,hoelang duurt voor dat ik in bezit zit van een bestelde bankkaart
cards.question.how_long.receive.bankcard,hoelang voordat een bankkaart wordt geleverd
cards.question.how_long.receive.bankcard,ik heb net een nieuwe kaart aangevraagd hoelang moet ik wachten om in die ontvangst te nemen
cards.question.how_long.receive.bankcard,wat is de levertermijn voor een nieuwe kaart
cards.question.how_long.receive.bankcard,wat is de levertijd van een nieuwe bankkaart
cards.question.how_long.receive.bankcard,hoelang duurt het voor een kaart beschikbaar is na de bestelling
cards.question.how_long.receive.bankcard,hoelang duurt het tot de kaart in mijn brievenbus zit
cards.question.how_long.receive.bankcard,een kaart aangevraagd maar hoelang duurt het voordat ik deze krijgt
cards.question.how_long.receive.bankcard,hoelang duurt het om een bank kaart te ontvangen
cards.question.how_long.receive.bankcard,hoelang voor dat je bankkaart krijgt
cards.question.how_long.receive.bankcard,Ik heb een bankkaart bestelt weet jij hoe lang duurt voordat deze geleverd wordt
cards.question.how_long.receive.bankcard,hoelang moet ik wachten op de levering van mijn kaart
cards.question.how_long.receive.bankcard,hoelang duurt het om de nieuwe bankkaart te ontvangen
cards.question.how_long.receive.bankcard,na het bestellen van een bankkaart hoelang moet je wachten voor dat je die krijgt
cards.question.how_long.receive.bankcard,hoelang moet ik wacht vooraleer ik mijn bankkaart ontvang
cards.question.how_long.receive.bankcard,hoelang voor de levering van mijn bankkaart
cards.question.how_long.receive.bankcard-creditcard,wat is de levertermijn voor een nieuwe creditcard
cards.question.how_long.receive.bankcard-creditcard,wat is de levertijd van een nieuwe kredietkaart
cards.question.how_long.receive.bankcard-creditcard,hoelang voor de bezorging van mijn visa kaart red
cards.question.how_long.receive.bankcard-creditcard,binnen hoeveel dagen ontvang ik mijn red mastercard
cards.question.how_long.receive.bankcard-creditcard,binnen hoeveel tijd ontvang ik mijn gouden mastercard
cards.question.how_long.receive.bankcard-creditcard,binnen welke termijn zal ik mijn krediet kaart ontvangen
cards.question.how_long.receive.bankcard-creditcard,hoe snel kan ik een mastercard hebben
cards.question.how_long.receive.bankcard-creditcard,hoe snel is het voor dat de bestelde kredietkaart in mijn brievenbus zit
cards.question.how_long.receive.bankcard-creditcard,hoelang duurt het om een white prepaidkaart te krijgen
cards.question.how_long.receive.bankcard-creditcard,hoelang duurt het om uw mastercard te ontvangen
cards.question.how_long.receive.bankcard-creditcard,hoelang duurt het voordat mijn kredietkaart bij het kantoor aankomt
cards.question.how_long.receive.bankcard-creditcard,hoelang duurt voor dat ik in bezit zit van een bestelde white mastercard
cards.question.how_long.receive.bankcard-creditcard,hoelang voordat een kredietkaart wordt geleverd
cards.question.how_long.receive.bankcard-creditcard,ik heb net een nieuwe platinum kredietkaart aangevraagd hoelang moet ik wachten om in die ontvangst te nemen
cards.question.how_long.receive.bankcard-creditcard,als ik een mastercard prepaid white aanvraag hoelang duurt het voor ik die ontvang
cards.question.how_long.receive.bankcard-creditcard,hoelang duurt het voor je je kredietkaart krijgt
cards.question.how_long.receive.bankcard-creditcard,hoelang duurt het voor je je kredietkaart ontvangt
cards.question.how_long.receive.bankcard-creditcard,hoelang duurt het vooraleer een kredietkaart geleverd kan worden
cards.question.how_long.receive.bankcard-creditcard,hoelang duurt het vooraleer ik een kredietkaart thuis krijg toegestuurd na deze te hebben aangevraagd
cards.question.how_long.receive.bankcard-creditcard,een mastercard aangevraagd maar hoelang duurt het voordat ik deze krijgt
cards.question.how_long.receive.bankcard-creditcard,hoelang duurt het om een prepaid kaart te ontvangen
cards.question.how_long.receive.bankcard-creditcard,hoelang duurt het vooraleer je jou visa kaart krijgt na een aanvraag
cards.question.how_long.receive.bankcard-creditcard,na het bestellen van een kreditkaart hoelang moet je wachten voor dat je die krijgt
cards.question.how_long.receive.bankcard-creditcard,hoelang moet ik wacht vooraleer ik mijn visa classic ontvang
cards.question.how_long.receive.bankcard-creditcard,hoelang duurt het alvorens ik de mastercard ontvang
cards.question.how_long.receive.bankcard-creditcard,ik heb de visa aangevraagd en ik vroeg mij af hoelang het duurt voordat ik deze zal ontvangen
cards.question.when.receive.bankcard,als ik een bank kaart aanvraag wanneer heb ik die dan
cards.question.when.receive.bankcard,als ik een bank kaart bestel wanneer heb ik ze dan
cards.question.when.receive.bankcard,als ik een bankkaart bestel wanneer wordt die dan thuis geleverd
cards.question.when.receive.bankcard,als ik een kaart aanvraag wanneer mag ik die dan ontvangen
cards.question.when.receive.bankcard,als ik een kaart bestel wanneer krijg ik die
cards.question.when.receive.bankcard,wanneer wordt mijn bankkaart thuis geleverd
cards.question.when.receive.bankcard,ik heb bankkaart aangevraagd en ik vroeg mij af tegen wanner zal ik deze ontvangen
cards.question.when.receive.bankcard,ik heb een bankkaart aangevraagd en vroeg mij af wanneer ik deze zou ontvangen
cards.question.when.receive.bankcard,ik heb een belfius bank kaart aangevraagd weet jij wanneer dat ik deze kaart thuis ontvang
cards.question.when.receive.bankcard,ik heb een kaart aangevraagd wanneer kan ik deze verwachten
cards.question.when.receive.bankcard,nieuwe kaart besteld wanneer mag ik die verwachten
cards.question.when.receive.bankcard,ik heb een nieuwe kaart aangevraagd maar heb de kaart nog niet ontvangen wanneer komt die aan
cards.question.when.receive.bankcard,Wanneer is mijn kaart beschikbaar
cards.question.when.receive.bankcard,wanneer komt mijn kaart thuis aan
cards.question.when.receive.bankcard,wanneer krijg ik mijn bankkaart
cards.question.when.receive.bankcard,wanneer wordt mijn bankkaart geleverd
cards.question.when.receive.bankcard,wanneer mijn kaart beschikbaar zal zijn
cards.question.when.receive.bankcard,weet jij wanneer ik mijn kaart ga krijgen
cards.question.when.receive.bankcard-creditcard,wanneer komt mijn mastercard thuis aan
cards.question.when.receive.bankcard-creditcard,als ik een kredietkaart bestel wanneer wordt die dan thuis geleverd
cards.question.when.receive.bankcard-creditcard,als ik een mastercard aanvraag wanneer heb ik die dan
cards.question.when.receive.bankcard-creditcard,als ik een mastercard aanvraag wanneer mag ik die dan ontvangen
cards.question.when.receive.bankcard-creditcard,als ik een mastercard gold bestel wanneer heb ik ze dan
cards.question.when.receive.bankcard-creditcard,als ik een prepaid kaart bestel wanneer krijg ik
cards.question.when.receive.bankcard-creditcard,wanneer wordt mijn kredietkaart geleverd
cards.question.when.receive.bankcard-creditcard,ik heb een mastercard aangevraagd wanneer kan ik deze verwachten
cards.question.when.receive.bankcard-creditcard,ik heb een nieuwe kredietkaart aangevraagd waneer wordt deze geleverd
cards.question.when.receive.bankcard-creditcard,ik heb een belfius white kredietkaart aangevraagd en vroeg me af wanneer krijg ik deze thuis geleverd
cards.question.when.receive.bankcard-creditcard,wanneer wordt mijn visa gold geleverd
cards.question.when.receive.bankcard-creditcard,kan ik mijn kredietkaart dezelfde dag nog krijgen
cards.question.when.receive.bankcard-creditcard,wanneer krijg je je kredietkaart opgestuurd
cards.question.when.receive.bankcard-creditcard,nieuwe mastercard besteld wanneer mag ik die verwachten
cards.question.when.receive.bankcard-creditcard,wanneer is mijn mastercard klaar
cards.question.when.receive.bankcard-creditcard,wanneer is mijn visa klaar
cards.question.when.receive.bankcard-creditcard,wanneer komt mijn krediet kaart aan
cards.question.when.receive.bankcard-creditcard,wanneer krijg ik mijn kredietkaart denk je
payments.question.how.execute.transfer,hoe doe ik best een overschrijving
payments.question.how.execute.transfer,hoe doe ik een overschijving toekomst
payments.question.how.execute.transfer,hoe een overschrijving uitvoeren
payments.question.how.execute.transfer,hoe kan ik een overdracht doen
payments.question.how.execute.transfer,hoe kan ik een overschrijving in de toekomst doen
payments.question.how.execute.transfer,hoe kan ik een overschrijving ingeven
payments.question.how.execute.transfer,hoe kan ik een overschrijving uitvoeren
payments.question.how.execute.transfer,hoe kan ik overschrijven
payments.question.how.execute.transfer,hoe kan ik overschrijving doen
payments.question.how.execute.transfer,hoe maak ik een overdracht
payments.question.how.execute.transfer,hoe maak ik een overschrijving aan
payments.question.how.execute.transfer,hoe moet ik een overschrijving in de toekomst doen
payments.question.how.execute.transfer,hoe doe ik een overschrijving
payments.question.how.execute.transfer,kan je uitleggen hoe overschrijvingen plaatsen
payments.question.how.execute.transfer,leg me uit hoe overschrijvingen werken
payments.question.how.execute.transfer,kan je uitleggen hoe ik een overschrijving doe
payments.question.how.execute.transfer,ik wil meer informatie over hoe ik overschrijvingen kan plaatsen
payments.question.how.execute.transfer,kan je mij verdere info geven over hoe ik een overschrijvingen kan ingeven
payments.question.how.execute.transfer,hoe geef ik een overschrijving in
payments.question.how.execute.payment,kan je mij verdere info geven over hoe ik een betaling kan doen
payments.question.how.execute.payment,hoe voer ik een betaling uit
payments.question.how.execute.payment,hoe doe ik betaling best
payments.question.how.execute.payment,hoe doe ik een betaling in de toekomst
payments.question.how.execute.payment,hoe een betaling uitvoeren
payments.question.how.execute.payment,hoe kan ik een betaling doen
payments.question.how.execute.payment,hoe kan ik een betaling in de toekomst doen
payments.question.how.execute.payment,hoe kan ik een betaling ingeven
payments.question.how.execute.payment,hoe kan ik een betaling uitvoeren
payments.question.how.execute.payment,hoe kan ik een betaling plaatsen
payments.question.how.execute.payment,hoe maak ik een betaling over
payments.question.how.execute.payment,vertel is hoe ik een betaling aanmaakt
payments.question.how.execute.payment,hoe moet ik een betaling in de toekomst ingeven
payments.question.how.execute.payment,hoe doe ik een betaling
payments.question.how.execute.payment,kan je uitleggen hoe ik een betaling kan plaatsen
payments.question.how.execute.payment,ik wil weten hoe ik een betaling kan uitvoeren
payments.question.how.execute.payment,vertel mij hoe ik een betaling kan doen
payments.question.how.execute.payment,ik wil meer informatie over hoe ik betaling kan plaatsen
payments.question.transaction,heb je meer info over de thema verrichtingen
payments.question.transaction,heb je meer info over verrichtingen
payments.question.transaction,ik begrijp niet wat een verrichting is
payments.question.transaction,ik heb meer infos over verrichtingen nodig
payments.question.transaction,ik vraag mij af wat een verrichting is
payments.question.transaction,ik vraag mij af wat verrichtingen zijn
payments.question.transaction,ik wil meer over verrichtingen weten
payments.question.transaction,ik zou graag info over verrichtingen krijgen
payments.question.transaction,ik zou graag meer info over verrichtingen
payments.question.transaction,ik zou graag meer info over verrichtingen hebben
payments.question.transaction,kan je me over verrichtingen vertellen
payments.question.transaction,kan je mij info over verrichtingen geven
payments.question.transaction,kan je mij meer over verrichtingen vertellen
payments.question.transaction,kan je mij verdere info over verrichtingen geven
payments.question.transaction,kan je mij zeggen wat een verrichting is
payments.question.transaction,kan je uitleggen wat een verrichting is
payments.question.transaction,leg me uit wat een verrichting is
payments.question.transaction,meer info over verrichtingen
payments.question.transaction,meer weten over verrichtingen
payments.question.transaction,waar kan ik meer over verrichtingen leren
payments.question.transaction,waar vind ik meer info over verrichtingen
payments.question.transaction,wat is een verrichting
payments.question.transfer,heb je meer info over de thema overschrijvingen
payments.question.transfer,heb je meer info over overschrijvingen
payments.question.transfer,kan je mij helpen met informatie over wat overschrijving is
payments.question.transfer,ik begrijp niet wat een overschrijving is
payments.question.transfer,ik heb een vraag over overschrijvingen
payments.question.transfer,ik heb meer info over overschrijvingen nodig
payments.question.transfer,ik vraag mij af hoe overschrijvingen werken
payments.question.transfer,ik vraag mij af wat een overschrijving is
payments.question.transfer,ik wil meer over overschrijvingen weten
payments.question.transfer,ik wil meer weten over overschrijvingen
payments.question.transfer,ik zou graag info over overschrijvingen krijgen
payments.question.transfer,ik zou graag meer info over overschrijvingen hebben
payments.question.transfer,kan ik meer informatie over overschrijvingen krijgen
payments.question.transfer,kan je me informatie over overschrijvingen geven
payments.question.transfer,kan je mij iets vertellen over overschrijvingen
payments.question.transfer,kan je mij info over overschrijvingen geven
payments.question.transfer,kan je mij zeggen wat een overschrijving is
payments.question.transfer,kan jij me nu ook info geven over overschrijvingen
payments.question.transfer,meer info over overschrijvingen
payments.question.transfer,meer over overschrijvingen
payments.question.transfer,overschrijving wat is dat precies
payments.question.transfer,waar kan ik meer over overschrijvingen leren
payments.question.transfer,waar vind ik meer info over overschrijvingen
payments.question.transfer,waar vind ik meer over overschrijvingen
payments.question.transfer,wat betekent een overschrijving
payments.question.transfer,wat is een overschrijving
payments.question.transfer,wat ken je van overschrijvingen
payments.question.transfer,wat precies zijn overschrijvingen
payments.question.transfer,wat weet je over overschrijvingen
payments.question.transfer,zeg me alles wat je weet over overschrijvingen
payments.request.execute.transfer,graag overschrijving doen
payments.request.execute.transfer,ik heb geen mastercard dus wil een gewone overschrijving doen
payments.request.execute.transfer,ik wil een overschrijving doen
payments.request.execute.transfer,ik wil een overschrijving uitvoeren
payments.request.execute.transfer,ik wil overschrijven
payments.request.execute.transfer,ik wil overschrijving doen
payments.request.execute.transfer,ik wil overschrijving in de toekomst doen
payments.request.execute.transfer,ik zou graag een overschrijving doen
payments.request.execute.transfer,ik zou graag overschrijving naar iemand doen
payments.request.execute.transfer,kan jij een overschrijving uitvoeren
payments.request.execute.transfer,overschrijving ingeven
payments.request.execute.transfer,overschrijving plaatsen
payments.request.execute.transfer,overschrijving uitvoeren
payments.request.execute.transfer,ik wil deze overschijving uitvoeren
payments.request.execute.transfer,deze overschrijving nu uitvoeren
payments.request.execute.transfer,ik moet een overschrijving doen
payments.request.execute.transfer,ik wil graag een overschrijving invoeren
payments.request.execute.transfer,ik wil deze overschijving doen
payments.request.execute.transaction,ik wil een gewone transactie doen
payments.request.execute.transaction,ik wil een verrichting doen
payments.request.execute.transaction,ik wil een verrichting uitvoeren
payments.request.execute.transaction,ik wil een transactie ingeven
payments.request.execute.transaction,ik wil transactie doen
payments.request.execute.transaction,ik zou graag een verrichting doen
payments.request.execute.transaction,transactie uitvoeren
payments.request.execute.transaction,kan jij een verrichting uitvoeren
payments.request.execute.transaction,ik wil verrichting in de toekomst doen
payments.request.execute.transaction,transacties plaatsen
payments.request.execute.transaction,verrichting uitvoeren
payments.request.execute.transaction,transactie ingeven
payments.request.execute.transaction,graag transactie doen
payments.request.execute.transaction,ik wil deze transactie uitvoeren
payments.request.execute.transaction,deze transactie nu uitvoeren
payments.request.execute.transaction,ik moet een verrichting doen
payments.request.execute.transaction,ik wil graag een verrichting invoeren
payments.request.execute.transaction,ik wil deze verrichting doen
smalltalk.user.help_needed,dringend advies nodig
smalltalk.user.help_needed,dringend hulp nodig
smalltalk.user.help_needed,help mij aub
smalltalk.user.help_needed,ik had een vraag
smalltalk.user.help_needed,ik heb aantwoord nodig
smalltalk.user.help_needed,ik heb een vraag voor jou
smalltalk.user.help_needed,ik heb hulp nodig
smalltalk.user.help_needed,ik heb jou nodig
smalltalk.user.help_needed,ik heb vragen
smalltalk.user.help_needed,Ik stelde mezelf de vraag
smalltalk.user.help_needed,ik zoek advies
smalltalk.user.help_needed,ik zoek help
smalltalk.user.help_needed,ik zoek informatie kan jij mij helpen
smalltalk.user.help_needed,kan ik hulp vragen
smalltalk.user.help_needed,kan je mj helpen aub
smalltalk.user.help_needed,kan jij mij vraag antwoorden
smalltalk.user.help_needed,kun je me helpen
smalltalk.user.help_needed,wie kan mij helpen
smalltalk.user.help_needed,zou jij mij kunnen helpen
smalltalk.user.help_needed,hoi kan je mij helpen
smalltalk.user.help_needed,hallo kan ik een vraag stellen aub
cards.report.forget.code.bankcard-creditcard,ik ben de code van mijn creditcard vergeten
cards.report.forget.code.bankcard-creditcard,ik ben de code van mijn master card vergeten
cards.report.forget.code.bankcard-creditcard,ik ben de geheime code van mijn mastercard volledig vergeten
cards.report.forget.code.bankcard-creditcard,ik ben mijn code van mijn mastercard vergeten
cards.report.forget.code.bankcard-creditcard,ik ben mijn code van mijn prepaid gold card vergeten
cards.report.forget.code.bankcard-creditcard,ik ben namelijk mijn code vergeten van mijn creditcard
cards.report.forget.code.bankcard-creditcard,ik denk dat ik mijn code ben vergeten van mijn kredietkaart
cards.report.forget.code.bankcard-creditcard,Ik heb een kredietkaart en ik ben mijn geheime code vergeten
cards.report.forget.code.bankcard-creditcard,Ik herinner me de code van mijn prepaid white niet
cards.report.forget.code.bankcard-creditcard,Ik kan de code van mastercard niet meer herinneren
cards.report.forget.code.bankcard-creditcard,Ik kan me de geheime code van mijn prepaidkaart niet herinneren
cards.report.forget.code.bankcard-creditcard,ik kan mijn kredietkaart code niet meer herinneren
cards.report.forget.code.bankcard-creditcard,ik weet mijn code van mijn mastercard platinum niet meer
cards.report.forget.code.bankcard-creditcard,ken code mastercard niet meer
cards.report.forget.code.bankcard-creditcard,Ik ken mijn mastercard code niet
cards.report.forget.code.bankcard-creditcard,ik weet de code van mijn kredietkaart niet
cards.report.forget.code.bankcard-creditcard,de code van de visa ben ik vergeten
cards.report.forget.pin_code.bankcard-creditcard,de pincode van de visa ben ik vergeten
cards.report.forget.pin_code.bankcard-creditcard,de pincode van mastercard prepaid vergeten
cards.report.forget.pin_code.bankcard-creditcard,ik ben de pincode van mijn creditcard vergeten
cards.report.forget.pin_code.bankcard-creditcard,ik ben de pincode van mijn kredietkaart vergeten
cards.report.forget.pin_code.bankcard-creditcard,ik ben de pincode van mijn mastercard volledig vergeten
cards.report.forget.pin_code.bankcard-creditcard,ik ben de pincode vergeten van mijn kredietkaart
cards.report.forget.pin_code.bankcard-creditcard,ik ben mijn pin code van mijn mastercard vergeten
cards.report.forget.pin_code.bankcard-creditcard,ik ben mijn pin code van mijn prepaid gold card vergeten
cards.report.forget.pin_code.bankcard-creditcard,ik ben mijn pincode van mijn visa vergeten
cards.report.forget.pin_code.bankcard-creditcard,ik ben mijn pincode vergeten van mijn kredietkaart
cards.report.forget.pin_code.bankcard-creditcard,ik ben mijn pincode vergeten van mijn prepaid kaart
cards.report.forget.pin_code.bankcard-creditcard,ik ben mijn pincode vergeten van mijn prepaid visa kaart
cards.report.forget.pin_code.bankcard-creditcard,ik heb een belfius white credit card maar ken mijn pincode niet meer
cards.report.forget.pin_code.bankcard-creditcard,Ik herinner me de pincode van mijn prepaidkaart niet
cards.report.forget.pin_code.bankcard-creditcard,Ik kan de pin code van mastercard niet meer herinneren
cards.report.forget.pin_code.bankcard-creditcard,ik kan de pincode van de mastercard niet meer herinneren
cards.report.forget.pin_code.bankcard-creditcard,ik ken mijn pincode van de kredietkaart niet meer
cards.report.forget.pin_code.bankcard-creditcard,ik weet de pincode van mijn kredietkaart niet
cards.report.forget.pin_code.bankcard-creditcard,ik weet mijn pin code van mijn visa niet meer
cards.report.forget.pin_code.bankcard-creditcard,ik weet de pincode van mijn kaart niet meer
cards.report.lost.code.bankcard-creditcard,code prepaid kwijt
cards.report.lost.code.bankcard-creditcard,code van mijn mastercard verloren
cards.report.lost.code.bankcard-creditcard,code verloren visa gold
cards.report.lost.code.bankcard-creditcard,de code van de visa ben ik verloren
cards.report.lost.code.bankcard-creditcard,geheime code van mijn krediet kaart verloren
cards.report.lost.code.bankcard-creditcard,het vraagt de code van mastercard die ik niet heb
cards.report.lost.code.bankcard-creditcard,Ik ben de creditcard code kwijt
cards.report.lost.code.bankcard-creditcard,ik ben mijn code kwijt van mijn kredietkaart
cards.report.lost.code.bankcard-creditcard,Ik ben mijn geheime code mastercard kwijt
cards.report.lost.code.bankcard-creditcard,ik ben mijn mastercard code kwijt
cards.report.lost.code.bankcard-creditcard,ik heb onlangs mijn prepaid kredietkaart ontvangen maar ik ben mijn geheime code kwijt
cards.report.lost.code.bankcard-creditcard,Ik kan de code van mijn white prepaidkaart niet vinden
cards.report.lost.code.bankcard-creditcard,Ik kon mijn geheime code voor mijn prepaidkaart niet vinden
cards.report.lost.code.bankcard-creditcard,Ik verloor de geheime code van mijn mastercard
cards.report.lost.code.bankcard-creditcard,Ik vind de code van mijn prepaidkaart niet
cards.report.lost.code.bankcard-creditcard,ik wil graag mijn visa gold activeren maar ben mijn code kwijt
cards.report.lost.code.bankcard-creditcard,mastercard gold code verloren
cards.report.lost.code.bankcard-creditcard,mijn  kredietkaart code is niet gevonden
cards.report.lost.pin_code.bankcard-creditcard,pin code van mijn mastercard verloren
cards.report.lost.pin_code.bankcard-creditcard,geheime pincode van mijn krediet kaart verloren
cards.report.lost.pin_code.bankcard-creditcard,Ik ben de creditcard pin kwijt
cards.report.lost.pin_code.bankcard-creditcard,ik ben mijn pin kwijt van mijn kredietkaart
cards.report.lost.pin_code.bankcard-creditcard,ik ben mijn mastercard pin code kwijt
cards.report.lost.pin_code.bankcard-creditcard,ik heb onlangs mijn prepaid kredietkaart ontvangen maar ik ben mijn geheime pin code kwijt
cards.report.lost.pin_code.bankcard-creditcard,Ik verloor de geheime pincode van mijn mastercard
cards.report.lost.pin_code.bankcard-creditcard,ik wil graag mijn visa gold activeren maar ben mijn pin kwijt
