intent,expression
cards.question.withdraw.cash.atm.bankcard-creditcard,kan ik met mijn visa geld uit de muur halen
cards.question.withdraw.cash.atm.bankcard-creditcard,kan ik cash uit de bankautomaat met kredietkaart afhalen
cards.question.withdraw.cash.atm.bankcard-creditcard,kan ik uit de bankautomaat geld halen met visa
cards.question.withdraw.cash.atm.bankcard-creditcard,kan ik geld uit de muur halen als ik mijn prepaid kaart gebruikt
cards.question.withdraw.cash.atm.bankcard-creditcard,met men visa kaart kan ik uit de automaat geld afhalen
cards.question.withdraw.cash.atm.bankcard-creditcard,kan ik met een kredietkaart geld uit de muur afhalen
cards.question.withdraw.cash.atm.bankcard-creditcard,als ik een kredietkaart heb kan ik dan geld van een automaat afhalen
cards.question.withdraw.cash.atm.bankcard-creditcard,kan geld van bankcontact afgehaald worden met een kredietkaart
cards.question.withdraw.cash.atm.bankcard-creditcard,kan ik een automaat gebruiken om geld te krijgen met een visa
cards.question.withdraw.cash.atm.bankcard-creditcard,geld van de muur vragen met een kredietkaart is dat mogelijk
cards.question.withdraw.cash.atm.bankcard-creditcard,is er geen probleem om geld van een selfservice automaat aan te vragen met een mastercard
cards.question.withdraw.cash.atm.bankcard-creditcard,kan ik zomaar bankcontact gebruiken om geld afvragen met een mastercard prepaid
cards.question.withdraw.cash.atm.bankcard-creditcard,moet er iets speciaals gebeuren om cash te kunnen afhalen van bankcontact met een kredietkaart
cards.question.withdraw.cash.atm.bankcard-creditcard,Kan ik geld aanvragen bij een automaat met de visa of niet
cards.question.withdraw.cash.atm.bankcard-creditcard,Kan je geld afhalen met een MasterCard van automaat
cards.question.withdraw.cash.atm.bankcard-creditcard,kan ik aan bankcontact geld ophalen met mijn kredietkaart
cards.question.withdraw.cash.atm.bankcard-creditcard,kan ik met kredietkaart cash van de muur ophalen
unspecified.question.withdraw.cash.limit.international,hoeveel euro kan ik per keer afhalen in een ander land
unspecified.question.withdraw.cash.limit.international,hoeveel geld kan ik eigenlijk afhalen als ik niet in belgie ben
unspecified.question.withdraw.cash.limit.international,hoeveel geld kan ik opnemen tijdens mijn vakantie in het buiteland
unspecified.question.withdraw.cash.limit.international,hoeveel cash kan ik in het buitenland afhalen
unspecified.question.withdraw.cash.limit.international,hoeveel euro kan ik max afhalen over de grens
unspecified.question.withdraw.cash.limit.international,ik wil graag weten wat is de limiet geld dat ik mag afhalen in een ander land
unspecified.question.withdraw.cash.limit.international,ik ga weg op zakenreis maximaal hoeveel cash kan ik afhalen
unspecified.question.withdraw.cash.limit.international,mijn vraag is gewoon hoeveel ik cash kan opvragen in het buitenland
unspecified.question.withdraw.cash.limit.international,tot hoeveel cash kan ik afhalen wanneer ik op reis ben
unspecified.question.withdraw.cash.limit.international,tijdens mijn vakantie tot hoeveel geld kan ik opvragen
unspecified.question.withdraw.cash.limit.international,tot welke bedrag kan ik afhalen in een ander land
unspecified.question.withdraw.cash.limit.international,wat is de limiet van geldafhaling in het buitenland
unspecified.question.withdraw.cash.limit.international,wat is het maximaal bedrag dak ik kan afhalen in het buitenland
unspecified.question.withdraw.cash.limit.international,wat is het maximale bedrag dat ik kan opvragen over de grens
unspecified.question.withdraw.cash.limit.international,wat voor limiet staat er op geldafhaling in het buitenland
unspecified.question.withdraw.cash.limit.international,wat is het maximale bedrag dat je kan afnemen als je niet in belgie ben
unspecified.question.withdraw.cash.limit.international,wat limiet voor uithalen van cash als je in het buitenland zit
unspecified.question.withdraw.cash.limit.international,vertel me tot hoeveel kan ik afhalen in het buitenland
unspecified.question.withdraw.cash.limit.international,ik ben aan het reizen en wil weten tot hoeveel geld kan ik afhalen
unspecified.question.withdraw.cash.limit.international,ik ben net over de grens en heb cash nodig wat is de maximum dat ik kan opnemen
unspecified.question.withdraw.cash.limit-time_duration.daily,wat is de dagelijks limiet voor geld afhalen
unspecified.question.withdraw.cash.limit-time_duration.daily,weet jij wat de maximum afhalen bedrag per dag is
unspecified.question.withdraw.cash.limit-time_duration.daily,hoeveel euro kan ik per dag afhalen
unspecified.question.withdraw.cash.limit-time_duration.daily,hoeveel geld kan ik dagelijks afhalen
unspecified.question.withdraw.cash.limit-time_duration.daily,tot hoeveel geld kan ik opnemen op een dag
unspecified.question.withdraw.cash.limit-time_duration.daily,hoeveel cash kan ik op een dag afhalen
unspecified.question.withdraw.cash.limit-time_duration.daily,hoeveel kan ik max afhalen op een dag
unspecified.question.withdraw.cash.limit-time_duration.daily,ik wil graag weten hoeveel geld mag ik afhalen in een dag
unspecified.question.withdraw.cash.limit-time_duration.daily,maximaal hoeveel cash kan ik afhalen op een dag
unspecified.question.withdraw.cash.limit-time_duration.daily,wat is de limiet cash kan ik opvragen in een dag
unspecified.question.withdraw.cash.limit-time_duration.daily,tot welke bedrag kan ik dagelijks afhalen
unspecified.question.withdraw.cash.limit-time_duration.daily,dagelijks tot hoeveel euro kan ik opvragen
unspecified.question.withdraw.cash.limit-time_duration.daily,tot welke max bedrag kan ik op een dag afhalen
unspecified.question.withdraw.cash.limit-time_duration.daily,wat is de limiet per dag van geldafhaling
unspecified.question.withdraw.cash.limit-time_duration.daily,wat is het maximaal bedrag dak ik dagelijks kan opnemen
unspecified.question.withdraw.cash.limit-time_duration.daily,wat is het limiet bedrag dat ik kan opvragen per dag
unspecified.question.withdraw.cash.limit-time_duration.daily,wat voor limiet staat er op dagelijks geldafhaling
unspecified.question.withdraw.cash.limit-time_duration.daily,wat is het maximale bedrag dat je dagelijkse kan afnemen
unspecified.question.withdraw.cash.limit-time_duration.daily,wat is de limiet voor uithalen van cash per dag
unspecified.question.withdraw.cash.limit-time_duration.daily,vertel me tot hoeveel kan ik afhalen in een dag
unspecified.question.withdraw.cash.limit-time_duration.weekly,wat is de wekelijkse limiet voor geld afhalen
unspecified.question.withdraw.cash.limit-time_duration.weekly,weet jij wat de maximum afhalen bedrag per week is
unspecified.question.withdraw.cash.limit-time_duration.weekly,hoeveel euro kan ik per week afhalen
unspecified.question.withdraw.cash.limit-time_duration.weekly,tot hoeveel geld kan ik wekelijkse afhalen
unspecified.question.withdraw.cash.limit-time_duration.weekly,tot hoeveel geld kan ik opnemen op een week
unspecified.question.withdraw.cash.limit-time_duration.weekly,hoeveel cash kan ik op een week afhalen
unspecified.question.withdraw.cash.limit-time_duration.weekly,hoeveel kan ik max afhalen op een week
unspecified.question.withdraw.cash.limit-time_duration.weekly,ik wil graag weten hoeveel geld mag ik afhalen in een week
unspecified.question.withdraw.cash.limit-time_duration.weekly,maximaal hoeveel cash kan ik afhalen op een week
unspecified.question.withdraw.cash.limit-time_duration.weekly,wat is de limiet cash kan ik opvragen in een week
unspecified.question.withdraw.cash.limit-time_duration.weekly,tot welke bedrag kan ik wekelijkse afhalen
unspecified.question.withdraw.cash.limit-time_duration.weekly,wekelijkse tot hoeveel euro kan ik opvragen
unspecified.question.withdraw.cash.limit-time_duration.weekly,tot welke max bedrag kan ik op een week afhalen
unspecified.question.withdraw.cash.limit-time_duration.weekly,wat is de limiet per week van geldafhaling
unspecified.question.withdraw.cash.limit-time_duration.weekly,wat is het maximaal bedrag dak ik wekelijks kan opnemen
unspecified.question.withdraw.cash.limit-time_duration.weekly,wat is het limiet bedrag dat ik kan opvragen per week
unspecified.question.withdraw.cash.limit-time_duration.weekly,wat voor limiet staat er op wekelijks geldafhaling
unspecified.question.withdraw.cash.limit-time_duration.weekly,wat is het maximale bedrag dat je wekelijks kan afnemen
unspecified.question.withdraw.cash.limit-time_duration.weekly,wat is de limiet voor uithalen van cash per week
unspecified.question.withdraw.cash.limit-time_duration.weekly,vertel me tot hoeveel kan ik afhalen in een week
cards.report.fraud.bankcard,er gebeurt fraude met mijn kaart
cards.report.fraud.bankcard,er is denk ik fraude gepleegd met mijn kaart
cards.report.fraud.bankcard,er is fraude gebeurd met mijn kaart
cards.report.fraud.bankcard,fraude kaart
cards.report.fraud.bankcard,fraude met kaart
cards.report.fraud.bankcard,fraude met mijn kaart
cards.report.fraud.bankcard,fraude op mijn kaart
cards.report.fraud.bankcard,ik denk dat er fraude gepleegd is met mijn kaart
cards.report.fraud.bankcard,Ik denk dat een fraudeur mijn kaart heeft gebruikt
cards.report.fraud.bankcard,ik denk dat er fraude is gebeurd met mijn kaart
cards.report.fraud.bankcard,ik denk dat er fraude met mijn kaart gepleegd is
cards.report.fraud.bankcard,ik denk dat er fraude op mijn kaart is
cards.report.fraud.bankcard,ik denk dat er gefraudeerd is met mijn kaart
cards.report.fraud.bankcard,ik vermoed fraude met mijn kaart
cards.report.fraud.bankcard,kaart fraude
cards.report.fraud.bankcard,mijn kaart is door iemand anders gebruikt. Er is fraude gepleegd volgens mij
cards.report.fraud.bankcard,misbruik van mijn kaart
cards.report.fraud.bankcard,oplichting met kaart
cards.report.fraud.bankcard,iemand heeft mijn kaart gebruikt zonder mijn toestemming
cards.report.fraud.bankcard,iemand anders heeft mijn kaart gebruikt
cards.report.fraud.bankcard-creditcard,er is fraude gepleegd met mijn mastercard
cards.report.fraud.bankcard-creditcard,er is fraude gepleegd met mijn visakaart
cards.report.fraud.bankcard-creditcard,fraude krediet kaart
cards.report.fraud.bankcard-creditcard,fraude kredietkaart
cards.report.fraud.bankcard-creditcard,fraude mastercard
cards.report.fraud.bankcard-creditcard,fraude met kredietkaart
cards.report.fraud.bankcard-creditcard,Fraude met mijn kredietkaart
cards.report.fraud.bankcard-creditcard,fraude met mijn visa help snel
cards.report.fraud.bankcard-creditcard,fraude met visa
cards.report.fraud.bankcard-creditcard,fraude op mastercard
cards.report.fraud.bankcard-creditcard,ik denk dat er fraude is gebeurd met mijn krediet kaart
cards.report.fraud.bankcard-creditcard,ik denk dat er fraude is gebeurd met mijn kredietkaart
cards.report.fraud.bankcard-creditcard,ik denk dat er sprake is van misbruik van mijn kredietkaart
cards.report.fraud.bankcard-creditcard,ik heb schrik dat er met mijn krediet kaart fraude gebeurd is
cards.report.fraud.bankcard-creditcard,ik vermoed fraude met mijn credit card
cards.report.fraud.bankcard-creditcard,ik vermoed fraude met mijn kredietkaart
cards.report.fraud.bankcard-creditcard,kredietkaart fraude
cards.report.fraud.bankcard-creditcard,met mijn mastercard gold is gefraudeerd
cards.report.fraud.bankcard-creditcard,oplichting met kredietkaart
cards.report.fraud.bankcard-creditcard,oplichting met mastercard
cards.report.fraud.bankcard-creditcard,oplichting met visa
cards.report.fraud.bankcard-creditcard,vermoedelijk is er fraude gebeurd met mijn visa
cards.report.unrecognized.payment.bankcard,ik heb een betaling die ik zelf niet gedaan heb op mijn kaart
cards.report.unrecognized.payment.bankcard,ik heb een betaling op mijn kaart die ik zelf niet heb gedaan
cards.report.unrecognized.payment.bankcard,ik heb een betaling op mijn bankkaart die niet van mij is
cards.report.unrecognized.payment.bankcard,ik herken een betaling op mijn kaart niet
cards.report.unrecognized.payment.bankcard,ik zie een betaling op mijn bankkaart die ik niet gedaan heb
cards.report.unrecognized.payment.bankcard,ik zie een betaling op mijn kaart die niet van mij is
cards.report.unrecognized.payment.bankcard,kan het zijn dat iemand anders een betaling deed met mijn kaart
cards.report.unrecognized.payment.bankcard,onbekende betaling op mijn bank kaart
cards.report.unrecognized.payment.bankcard,er is een betaling gebeurd met mijn kaart die niet door mij is uitgevoerd
cards.report.unrecognized.payment.bankcard,er is een betaling gebeurd met mijn kaart en ik was het niet
cards.report.unrecognized.payment.bankcard,er is een betaling gebeurd met mijn kaart niet door mij
cards.report.unrecognized.payment.bankcard,er is een betaling gedaan met mijn kaart die ik niet herkent
cards.report.unrecognized.payment.bankcard,er is een betaling gebeurt dat ik niet herkent
cards.report.unrecognized.payment.bankcard,er is een onbekende betaling met mijn bankkaart. ik herkent die niet
cards.report.unrecognized.payment.bankcard,iemand anders heeft betaald met mijn bankkaart
cards.report.unrecognized.payment.bankcard,onbekende mens heeft mijn bankkaart gebruikt om betaling te doen
cards.report.unrecognized.payment.bankcard,ik vermoed dat iemand heeft een frauduleuze betaling heft gedaan met mijn kaart
cards.report.unrecognized.payment.bankcard,er staan betalingen op mijn bankkaart die ik niet zelf heb ingegeven
cards.report.unrecognized.payment.bankcard,er staan enkele betalingen op mijn kaart die ik nooit heb gedaan
cards.report.unrecognized.payment.bankcard,Ik heb deze betaling niet uitgevoerd op mijn bankkaart
cards.report.unrecognized.payment.bankcard,er is een betaling door iemand anders gedaan met mijn kaart
cards.report.unrecognized.payment.bankcard,er heeft iemand anders een betaling gedaan met mijn kaart
cards.report.unrecognized.payment.bankcard,er is betaald met mijn kaart en ik heb dat niet gedaan
cards.report.unrecognized.payment.bankcard-creditcard,ik heb een betaling op mijn kredietkaart die niet van mij is
cards.report.unrecognized.payment.bankcard-creditcard,ik zie een betaling op mijn kredietkaart die ik niet gedaan heb
cards.report.unrecognized.payment.bankcard-creditcard,op mijn mastercard zie ik een betaling die ik niet gedaan hebt
cards.report.unrecognized.payment.bankcard-creditcard,onbekende betaling op mijn kredietkaart
cards.report.unrecognized.payment.bankcard-creditcard,onbekende betaling op mijn mastercard
cards.report.unrecognized.payment.bankcard-creditcard,betaling door onbekende op mijn visa
cards.report.unrecognized.payment.bankcard-creditcard,er is een betaling gebeurd die ik niet ken met mijn kredietkaart
cards.report.unrecognized.payment.bankcard-creditcard,er is een betaling gedaan met mijn kredietkaart en ik ken die niet
cards.report.unrecognized.payment.bankcard-creditcard,er ziet een onbekende betaling op mijn kredietkaart
cards.report.unrecognized.payment.bankcard-creditcard,er is een betaling gedaan met mijn visa en ik heb dat niet gedaan
cards.report.unrecognized.payment.bankcard-creditcard,er is een betaling van mijn mastercard gold gegaan en ik weet niet wat het is
cards.report.unrecognized.payment.bankcard-creditcard,er is een betaling van mijn kredietkaart rekening dat onbevoegd was
cards.report.unrecognized.payment.bankcard-creditcard,er is een betaling door iemand anders gedaan met mijn mastercard gold
cards.report.unrecognized.payment.bankcard-creditcard,Iemand anders heeft betalingen vericht met mijn krediet kaart
cards.report.unrecognized.payment.bankcard-creditcard,ik herken een betaling op mijn kredietkaart niet
cards.report.unrecognized.payment.bankcard-creditcard,ik zie een ongekende betaling op mijn visa white prepaid staan
cards.report.unrecognized.payment.bankcard-creditcard,ik heb een onbekende betaling op mijn prepaid mastercard
cards.report.unrecognized.payment.bankcard-creditcard,iemand dat ik niet ken heeft een betaling gedaan met mijn kredietkaart
cards.report.unrecognized.payment.bankcard-creditcard,onbekende mensen hebben betalingen verricht met mijn mastercard
cards.report.unrecognized.payment.bankcard-creditcard,ongekend betaling op mijn mastercard
cards.report.unrecognized.payment.bankcard-creditcard,er heeft iemand anders een betaling gedaan met mijn prepaid white
cards.report.unrecognized.payment.bankcard-creditcard,ik zie een betaling met mijn kredietkaart staan die ik niet gedaan heb
cards.report.unrecognized.transaction.bankcard,er staat een transactie op mijn afrekening die ik niet ken
cards.report.unrecognized.transaction.bankcard,er staat een transactie op mijn kaart die ik niet herken
cards.report.unrecognized.transaction.bankcard,er staat een verrichting op mijn kaart die ik niet ken wat nu
cards.report.unrecognized.transaction.bankcard,help ik zie transacties op de kaart die ik niet zelf heb gedaan
cards.report.unrecognized.transaction.bankcard,ik heb een onbekende transactie op mijn kaart
cards.report.unrecognized.transaction.bankcard,ik ken de verrichting op mijn kaart niet
cards.report.unrecognized.transaction.bankcard,ik zie hier transacties op mijn kaart die ik niet zelf heb gedaan
cards.report.unrecognized.transaction.bankcard,onbekende transactie op mijn kaart
cards.report.unrecognized.transaction.bankcard,transactie op kaart die ik niet ken
cards.report.unrecognized.transaction.bankcard,verrichting op kaart ongekend
cards.report.unrecognized.transaction.bankcard,er is een bedrag van mijn bankkaart afgegaan om onbekende redenen
cards.report.unrecognized.transaction.bankcard,er is een bedrag van mijn kaart rekening dat onbevoegd was
cards.report.unrecognized.transaction.bankcard,Iemand anders heeft transacties vericht met mijn bankkaart
cards.report.unrecognized.transaction.bankcard,ik herken een verrichting op mijn bankkaart niet
cards.report.unrecognized.transaction.bankcard,ik zie een ongekende transactie op mijn kaart staan
cards.report.unrecognized.transaction.bankcard,ik heb een onbekende verrichting op mijn bankkaart
cards.report.unrecognized.transaction.bankcard,bankkaart transactie is voor mij totaal onbekend
cards.report.unrecognized.transaction.bankcard-creditcard,er is op de mastercard een bedrag gereserveerd voor afname terwijl dit nooit betaald hebben wat kunnen we doen
cards.report.unrecognized.transaction.bankcard-creditcard,er zijn recent vreemde bedragen van mijn mastercard kredietkaart afgetrokken
cards.report.unrecognized.transaction.bankcard-creditcard,er zijn zaken afgeboekt op mijn mastercard waar ik niet van weet
cards.report.unrecognized.transaction.bankcard-creditcard,ik heb een transactie op mijn kredietkaart die ik niet herken
cards.report.unrecognized.transaction.bankcard-creditcard,onbekende transactie bij afrekening kredietkaart
cards.report.unrecognized.transaction.bankcard-creditcard,onbekende transactie op mijn kredietkaart
cards.report.unrecognized.transaction.bankcard-creditcard,onbekende transactie op mijn mastercard
cards.report.unrecognized.transaction.bankcard-creditcard,verrichting door onbekende op mijn visa
cards.report.unrecognized.transaction.bankcard-creditcard,er is een bedrag van mijn kredietkaart red afgegaan om onbekende redenen
cards.report.unrecognized.transaction.bankcard-creditcard,er is een bedrag van mijn mastercard afgegaan dat onbevoegd was
cards.report.unrecognized.transaction.bankcard-creditcard,er is een transactie door iemand anders gedaan met mijn kredietkaart
cards.report.unrecognized.transaction.bankcard-creditcard,Iemand anders heeft transacties vericht met mijn mastercard
cards.report.unrecognized.transaction.bankcard-creditcard,ik herken een verrichting op mijn visa niet
cards.report.unrecognized.transaction.bankcard-creditcard,ik zie een ongekende transactie op mijn visa classic staan
cards.report.unrecognized.transaction.bankcard-creditcard,ik heb onbekende verrichtingen staan op mijn kredietkaart
cards.report.unrecognized.transaction.bankcard-creditcard,ik heb een transactie op mijn kredietkaart die niet van mij is
cards.report.unrecognized.transaction.bankcard-creditcard,ik zie een verrichting op mijn kredietkaart die ik niet gedaan heb
cards.report.unrecognized.transaction.bankcard-creditcard,op mijn mastercard zie ik een verrichting die ik niet gedaan hebt
payments.question.unrecognized.transaction,hoe handel ik in geval van een onbekende verrichting
payments.question.unrecognized.transaction,hoe moet ik handelen in geval van een onbekende verrichting
payments.question.unrecognized.transaction,ik heb een onbekende verrichting gekregen wat moet ik doen
payments.question.unrecognized.transaction,ik ken een verrichting niet wat moet ik doen
payments.question.unrecognized.transaction,kan je me met een onbekende verrichting helpen
payments.question.unrecognized.transaction,kan je mij helpen in geval van een onbekende verrichting
payments.question.unrecognized.transaction,wat moet ik doen met een onbekende verrichting
payments.question.unrecognized.transaction,wat doe ik als ik een transactie niet herken
payments.question.unrecognized.transaction,ik zie een verrichting die ik niet ken kan je mij helpen
payments.question.unrecognized.transaction,in geval van een onbekende verrichting wat moet ik doen
payments.question.unrecognized.transaction,wat kan ik doen in geval van een onbekende verrichting
payments.question.unrecognized.transaction,wat te doen ik als ik een verrichting niet ken
payments.question.unrecognized.transaction,wat moet ik doen in geval van een onbekende verrichting
payments.question.unrecognized.transaction,wat moet ik doen in het geval van een onbekende verrichting
payments.question.unrecognized.transaction,welke stappen moet ik ondernemen als ik een verrichting niet ken
payments.question.unrecognized.transaction,ik zie een verrichting dat ik niet herkent wat moet ik doen
payments.question.unrecognized.transaction,moet ik de bank verwittigen als ik een onbekende verrichting zie
payments.question.unrecognized.transaction,wie kan mij helpen in het geval van een onbevoegde transactie
payments.question.unrecognized.transaction,wat als ik een onbekende transactie zie
payments.question.unrecognized.transaction,wat te doen in geval van onbekende transacties
payments.report.unrecognized.payment,deze betaling is niet gekend door ons
payments.report.unrecognized.payment,er is een betaling gebeurd die ik niet herken
payments.report.unrecognized.payment,er is een betaling gedaan die ik niet herken
payments.report.unrecognized.payment,ik heb een betaling gedaan die frauduleus blijkt te zijn
payments.report.unrecognized.payment,ik heb een betaling die ik niet ken
payments.report.unrecognized.payment,ik herken de betaling niet
payments.report.unrecognized.payment,ik herken een betaling niet
payments.report.unrecognized.payment,onbekende betaling
payments.report.unrecognized.payment,rare betaling
payments.report.unrecognized.payment,betaling onbekend
payments.report.unrecognized.payment,deze betaling is mij niet gekend
payments.report.unrecognized.payment,ik herkent die betaling niet
payments.report.unrecognized.payment,onbekende betalingen
payments.report.unrecognized.payment,er zijn verschillende betalingen die ik niet heb gedaan
payments.report.unrecognized.payment,ik zie verschillende onbekende betalingen
payments.report.unrecognized.payment,er is een betaling die ik niet herken
payments.report.unrecognized.payment,ik heb een betaling die ik niet gedaan heb
payments.report.unrecognized.payment,ik heb een betaling die ik niet herken
payments.report.unrecognized.payment,betaling niet gekend
payments.report.unrecognized.payment,ik zie een vreemde betaling
payments.report.unrecognized.transaction,een onbekende verrichting
payments.report.unrecognized.transaction,een verrichting die ik niet ken
payments.report.unrecognized.transaction,een winkel die ik niet ken heeft geld afgehouden
payments.report.unrecognized.transaction,er is een verrichting die ik niet herken
payments.report.unrecognized.transaction,ik heb een transactie die ik niet ken
payments.report.unrecognized.transaction,ik heb een transactie die ik niet gedaan heb
payments.report.unrecognized.transaction,ik heb een verrichting die ik niet herken
payments.report.unrecognized.transaction,ik herken een transactie niet
payments.report.unrecognized.transaction,ik zie een vreemde transactie
payments.report.unrecognized.transaction,niet herkende verrichting
payments.report.unrecognized.transaction,onbekende transactie
payments.report.unrecognized.transaction,onbekende verrichting
payments.report.unrecognized.transaction,transactie ongekend
payments.report.unrecognized.transaction,verrichting niet gekend
payments.report.unrecognized.transaction,vreemde transactie
payments.report.unrecognized.transaction,deze verrichting is mij niet gekend
payments.report.unrecognized.transaction,ik herkent die transactie niet
payments.report.unrecognized.transaction,onbekende verrichtingen
payments.report.unrecognized.transaction,er zijn verschillende transacties die ik niet heb gedaan
payments.report.unrecognized.transaction,ik zie verschillende onbekende verrichtingen
unspecified.question.fraud,ik ben opgelicht wat nu
unspecified.question.fraud,ik heb een vraag ontrend fraude
unspecified.question.fraud,wat doe ik bij vermoeden fraude
unspecified.question.fraud,wat met fraude
unspecified.question.fraud,wat te doen bij vaststelling van fraude
unspecified.question.fraud,wat weet je over fraude
unspecified.question.fraud,wat te doen in geval van frauduleus gebruik
unspecified.question.fraud,wat als ik fraude vermoed
unspecified.question.fraud,wat als ik denk dat ik opgelicht ben
unspecified.question.fraud,wat moet ik doen in geval van fraude
unspecified.question.fraud,wat als ik een zwendel vermoed
unspecified.question.fraud,wat als ik werd opgelicht
unspecified.question.fraud,Ik ben slachtoffer van fraude wat moet ik nu doen
unspecified.question.fraud,wat te doen bij bankfraude
unspecified.question.fraud,wij hebben fraude ontdekt wat nu
