intent,expression
accounts.question.when.reimburse.settlement.bankcard-creditcard,als ik nu een uitgave doe met mijn gold wanneer gaat dat dan van mijn rekening
accounts.question.when.reimburse.settlement.bankcard-creditcard,als je betaalt met mastercard wanneer gaat dat bedrag van je rekening
accounts.question.when.reimburse.settlement.bankcard-creditcard,als je je gold kaart gebruikt gaat dan die in 1 keer van je zichtrekening af de volgende maand
accounts.question.when.reimburse.settlement.bankcard-creditcard,ik heb een belfius mastercard gold wanneer wordt deze van de zichtrekening gedebiteerd
accounts.question.when.reimburse.settlement.bankcard-creditcard,ik heb een mastercard gold wanneer gaat het bedrag van mijn aankoop van mijn rekening
accounts.question.when.reimburse.settlement.bankcard-creditcard,ik heb gisteren een betaling gedaan met mijn kredietkaart wanneer gaat dat bedrag van mijn rekening
accounts.question.when.reimburse.settlement.bankcard-creditcard,ik wou vragen wanneer worden ongeveer de uitgaven van kredietkaart van mijn zichtrekening gedebiteerd
accounts.question.when.reimburse.settlement.bankcard-creditcard,Wanneer gaat het bedrag van mastercard gold van de rekening
accounts.question.when.reimburse.settlement.bankcard-creditcard,wanneer gaat het geld af van mijn zichtrekening bij gebruik van mijn mastercard
accounts.question.when.reimburse.settlement.bankcard-creditcard,wanneer gaat het maandelijks bedrag van mijn mastercard van mijn zichtrekening
accounts.question.when.reimburse.settlement.bankcard-creditcard,wanneer is mijn rekening gedebiteerd voor mijn betalingen die ik heb gedaan met mijn kredietkaart
accounts.question.when.reimburse.settlement.bankcard-creditcard,wanneer worden de kosten die ik met mijn mastercard heb gedaan van mijn bankrekening gehaald
accounts.question.when.reimburse.settlement.bankcard-creditcard,wanneer wordt de uitgaven van mijn kredietkaart van mijn rekening gedebiteerd
accounts.question.when.reimburse.settlement.bankcard-creditcard,wanneer wordt het bedrag van de mastercard gold van mijn rekening gedebiteerd
accounts.question.when.reimburse.settlement.bankcard-creditcard,wanneer wordt het bedrag van mijn kredietkaart afgehouden van mijn rekening
accounts.question.when.reimburse.settlement.bankcard-creditcard,wanneer wordt het geld afgetrokken van mijn rekening voor de gold kredietkaart
accounts.question.when.reimburse.settlement.bankcard-creditcard,wanneer wordt het geld van mijn rekening gehaald om mastercard red af te betalen
accounts.question.when.reimburse.settlement.bankcard-creditcard,ik heb een gold kredietkaart van belfius ik vroeg me af of het geld automatisch van onze zichtrekening wordt afgehaald
accounts.question.when.reimburse.settlement.bankcard-creditcard,we hebben betalingen gedaan met onze mastercard gold wanneer gaan deze betalingen van de rekening af
accounts.question.when.reimburse.settlement.bankcard-creditcard,wordt de afrekening van mastercard automatisch van zichtrekening gedebiteerd
cards.question.bankcard.defect,als mijn kaart is beschadigd wat moet ik dan doen
cards.question.bankcard.defect,bankkaart blijkt beschadigd te zijn wat moet ik doen
cards.question.bankcard.defect,bankkaarten geven constant problemen wat zou er mis mee zijn
cards.question.bankcard.defect,ik weet niet waarom maar ik kan mijn bankkaart niet gebruiken
cards.question.bankcard.defect,ik zoek iemand dat mij kan helpen met mijn bankkaart die beschadigd is
cards.question.bankcard.defect,kan je mij helpen met mijn bank kaart. er is iets mis mee
cards.question.bankcard.defect,krijg altijd problemen met mijn kaarten kan jij mij helpen
cards.question.bankcard.defect,mijn bank kaart doet niet naar behoren kan jij mij helpen
cards.question.bankcard.defect,mijn bankkaart kan ik niet gebruiken waarom
cards.question.bankcard.defect,mijn bankkaart werkt niet kan je me hierbij helpen
cards.question.bankcard.defect,mijn kaart doet er niet meer en ik weet niet waarom Ik wil dat je mij helpt
cards.question.bankcard.defect,mijn kaart doet het niet wat nu
cards.question.bankcard.defect,mijn kaart heeft een probleem kan u mij helpen
cards.question.bankcard.defect,mijn kaart heeft tot gisteren goed gewerkt maar vandaag werk die niet meer wat moet ik doen
cards.question.bankcard.defect,mijn kaart werkt niet meer wat moet ik doen
cards.question.bankcard.defect,mijn kaart werkt niet wat moet ik doen
cards.question.bankcard.defect,waarom werkt men kaart niet
cards.question.bankcard.defect,wat is er mis met mijn bankkaart
cards.question.bankcard.defect,wat is er mis met mijn bankkaart wie kan is nakijken
cards.question.bankcard.defect,mijn kaart is kapot wat moet ik doen
cards.question.bankcard.defect-creditcard,als mijn mastercard gold is beschadigd wat moet ik dan doen
cards.question.bankcard.defect-creditcard,hoe komt het dat mijn mastercard niet werkt
cards.question.bankcard.defect-creditcard,ik moet mijn kredietkaart gebruiken maar er is iets mee kunnen jullie mij dringend helpen
cards.question.bankcard.defect-creditcard,ik wil een betaling doen met mijn creditcard maar het werkt niet kan jij is bekijken waarom
cards.question.bankcard.defect-creditcard,kan je mij helpen met mijn mastercard die werk niet zo goed
cards.question.bankcard.defect-creditcard,kredietkaart geeft constant problemen wat zou er mis mee zijn
cards.question.bankcard.defect-creditcard,kredietkaart is beschadigd kan jij mij helpen
cards.question.bankcard.defect-creditcard,mijn mastercard kan ik niet gebruiken waarom
cards.question.bankcard.defect-creditcard,mijn mastercard prepaidkaart werkt niet kan je me hierbij helpen
cards.question.bankcard.defect-creditcard,mijn prepaid krediet kaart werkt niet ik heb wel geld op wat moet ik doen
cards.question.bankcard.defect-creditcard,mijn prepaid kredietkaart heeft een probleem kan u mij helpen
cards.question.bankcard.defect-creditcard,mijn prepaidkaart werkt niet kan je me hierbij helpen
cards.question.bankcard.defect-creditcard,volgens mij werkt mijn mastercard niet goed kan jij mij helpen
cards.question.bankcard.defect-creditcard,waarom is mijn kredietkaart defect
cards.question.bankcard.defect-creditcard,waarom kan ik mijn kredietkaart niet gebruiken
cards.question.bankcard.defect-creditcard,waarom werkt men kredietkaart niet in hotel
cards.question.bankcard.defect-creditcard,waarom werkt mijn mastercard niet goed
cards.question.bankcard.defect-creditcard,wat is er met mijn kredietkaart
cards.question.bankcard.defect-creditcard,Wat moet ik doen als kredietkaart beschadigd is
cards.question.bankcard.defect-creditcard,ik wil mijn  kredietkaart gebruiken maar deze blijkt defect te zijn hoe kan dit
cards.question.change.limit.bankcard,ben je zeker dat de limiet van een bankkaart anders kan zijn
cards.question.change.limit.bankcard,de limiet van mijn kaart aanpassen mag dat
cards.question.change.limit.bankcard,ik heb een vraag over mijn bankkaart kan ik de limiet wijzigen
cards.question.change.limit.bankcard,ik heb vragen over mijn bankkaart kan ik de limiet wijzigen
cards.question.change.limit.bankcard,is de kredietlimiet van mijn kaart wijzigbaar
cards.question.change.limit.bankcard,is de limiet van een bankkaart wijzigbaar
cards.question.change.limit.bankcard,is het mogelijk om de limiet van een kaart te veranderen
cards.question.change.limit.bankcard,kan de grens van de limiet van de bank kaart gewijzigd worden
cards.question.change.limit.bankcard,kan de limiet van een bankkaart gemodificeerd worden
cards.question.change.limit.bankcard,kan ik de limiet van een bankkaart laten veranderen
cards.question.change.limit.bankcard,kan ik de limiet van mijn Belfius bankkaart white anders maken
cards.question.change.limit.bankcard,kan ik de limiet van mijn Belfius kaart changeren
cards.question.change.limit.bankcard,kan je de limiet op je bankkaart veranderen
cards.question.change.limit.bankcard,kan jij de limiet van mijn kaart aanpassen of wijzigen
cards.question.change.limit.bankcard,wat is het maximum bedrag voor de wijziging van de limiet van een kaart
cards.question.change.limit.bankcard,ik moet binnenkort een belangrijke betaling doen kan ik hiervoor de limiet van mijn kaart aanpassen
cards.question.change.limit.bankcard,is aanpassing van limiet van bankkaart mogelijk
cards.question.change.limit.bankcard,wijziging van limiet van kaart is het mogelijk
cards.question.change.limit.bankcard-creditcard,ben je zeker dat de limiet van een kredietkaart kan anders zijn
cards.question.change.limit.bankcard-creditcard,ik heb een vraag over de mastercard gold kan ik de limiet wijzigen
cards.question.change.limit.bankcard-creditcard,ik moet binnenkort een grote betaling doen kan ik hiervoor 1 malig de limiet van mijn mastercard aanpassen
cards.question.change.limit.bankcard-creditcard,is de kredietlimiet van mastercard red wijzigbaar
cards.question.change.limit.bankcard-creditcard,kan de grens van de limiet van de visa gewijzigd worden
cards.question.change.limit.bankcard-creditcard,kan de limiet van kredietkaart gemodificeerd worden
cards.question.change.limit.bankcard-creditcard,kan ik de limiet van een visa classic laten veranderen
cards.question.change.limit.bankcard-creditcard,kan ik de limiet van mijn Belfius kredietkaart veranderen
cards.question.change.limit.bankcard-creditcard,kan ik de limiet van mijn kredietkaart white anders maken
cards.question.change.limit.bankcard-creditcard,kan ik de limiet van mijn kredietkaart wijzigen
cards.question.change.limit.bankcard-creditcard,kan ik de plafon van mijn mastercard laten wijzigen
cards.question.change.limit.bankcard-creditcard,kan ik veranderen tot hoeveel ik kan uitgeven met mijn kredietkaart
cards.question.change.limit.bankcard-creditcard,kan je de limiet die op je mastercard gold modificieren
cards.question.change.limit.bankcard-creditcard,kan je de limiet van mijn kredietkaart laten wijzigen
cards.question.change.limit.bankcard-creditcard,kan je mij helpen met de limiet van mijn kredietkaart aan te passen
cards.question.change.limit.bankcard-creditcard,kan je mij laten zien de bestedingslimiet van mijn creditcard te wijzigen
cards.question.change.limit.bankcard-creditcard,kan jij de limiet die op mijn mastercard gold veranderen
cards.question.change.limit.bankcard-creditcard,mijn kredietkaart limiet kan dit gewijzigd worden
cards.question.change.limit.bankcard-creditcard,kan je limiet van kredietkaart aanpassen
cards.question.change.limit.bankcard-creditcard,is aanpassing van limiet van kredietkaart mogelijk
cards.question.check.expenditure_statement.bankcard-creditcard,ik zoek uitgavenstaat van mastercard van vorige maand waar vind ik die
cards.question.check.expenditure_statement.bankcard-creditcard,Ik zou een overzicht van kredietkaart afrekening willen zien
cards.question.check.expenditure_statement.bankcard-creditcard,kan ik de afrekening van mijn krediektaart nagaan
cards.question.check.expenditure_statement.bankcard-creditcard,kan ik de afrekening van mijn krediektaart zien
cards.question.check.expenditure_statement.bankcard-creditcard,kan ik een duplicaat van mijn afrekening zien
cards.question.check.expenditure_statement.bankcard-creditcard,kan ik mijn mastercard afrekening op voorhand zien
cards.question.check.expenditure_statement.bankcard-creditcard,kredietkaart afrekening checken waar vind ik dat
cards.question.check.expenditure_statement.bankcard-creditcard,waar kan ik de afrekening van mijn kredietkaart opvragen
cards.question.check.expenditure_statement.bankcard-creditcard,waar kan ik de afrekening van mijn kredietkaart terugvinden
cards.question.check.expenditure_statement.bankcard-creditcard,waar kan ik de afrekening van mijn mastercard gold in detail bekijken
cards.question.check.expenditure_statement.bankcard-creditcard,waar kan ik de afrekening van mijn visa in detail bekijken
cards.question.check.expenditure_statement.bankcard-creditcard,waar kan ik de kredietkaart afrekening checken
cards.question.check.expenditure_statement.bankcard-creditcard,waar vind ik de afrekening van mijn kredietkaart terug?
cards.question.check.expenditure_statement.bankcard-creditcard,waar vind ik de lijst van alles dat ik heb uitgegeven met mijn mastercard terug vinden
cards.question.check.expenditure_statement.bankcard-creditcard,waar vind ik de uitgaventstaat van kredietkaart
cards.question.check.expenditure_statement.bankcard-creditcard,waar zie ik de historiek van alle uitgaven van mijn kredietkaart
cards.question.check.expenditure_statement.bankcard-creditcard,weet jij waar kan ik de mastercard uitgavenstaat van februari vinden
cards.question.check.expenditure_statement.bankcard-creditcard,waar vind ik een duplicaat van mijn afrekening
cards.question.how.change.limit.bankcard,hoe kan ik de limiet van mijn bank kaart aanpassen
cards.question.how.change.limit.bankcard,hoe kan ik de limiet van mijn kaart veranderen
cards.question.how.change.limit.bankcard,hoe kan je de limiet die op je bankkaart veranderen
cards.question.how.change.limit.bankcard,hoe moet ik mijn limiet van mijn kaart wijzigen
cards.question.how.change.limit.bankcard,hoe pas ik de limiet van mijn bankkaart aan
cards.question.how.change.limit.bankcard,hoe verander je de maximum bedrag van een kaart
cards.question.how.change.limit.bankcard,hoe verander je de maximum limiet van een bankkaart
cards.question.how.change.limit.bankcard,hoe wijzig ik de reserve van mijn bankkaart
cards.question.how.change.limit.bankcard,hoe wijzig ik de reserve van mijn belfius bankkaart
cards.question.how.change.limit.bankcard,hoe wijzig je de limiet van een bank kaart
cards.question.how.change.limit.bankcard,hoe wijzig je de limiet van een kaart
cards.question.how.change.limit.bankcard,ik wil weten hoe ik de limiet van de bank kaart kan veranderen
cards.question.how.change.limit.bankcard,ik wil weten hoe ik de limiet van mijn kaart kan veranderen
cards.question.how.change.limit.bankcard,limiet van mijn kaart moet anders zijn maar ik weet niet hoe kan je mij helpen
cards.question.how.change.limit.bankcard,zeg is hoe pas ik de limiet aan van mijn belfius kaart
cards.question.how.change.limit.bankcard,zeg mij is hoe kan ik de limiet van mijn kaart aanpassen
cards.question.how.change.limit.bankcard,hoe kan je de limiet van een bankkaart wijzigen
cards.question.how.change.limit.bankcard-creditcard,Hoe de limiet van mijn kredietkaart wijzigen
cards.question.how.change.limit.bankcard-creditcard,hoe kan ik de limiet van mijn kredietkaart aanpassen
cards.question.how.change.limit.bankcard-creditcard,hoe kan ik de limiet van mijn mastercard red veranderen
cards.question.how.change.limit.bankcard-creditcard,hoe kan ik de limiet van mijn prepaid kredietkaart wijzigen
cards.question.how.change.limit.bankcard-creditcard,hoe kan ik mijn limiet van mijn kredietkaart aanpassen
cards.question.how.change.limit.bankcard-creditcard,hoe moet ik mijn limiet van mijn kredietkaart wijzigen
cards.question.how.change.limit.bankcard-creditcard,hoe pas ik de limiet aan van mijn mastercard
cards.question.how.change.limit.bankcard-creditcard,hoe pas ik de limiet van mijn kredietkaart aan
cards.question.how.change.limit.bankcard-creditcard,hoe verander ik de limiet van mijn Visa
cards.question.how.change.limit.bankcard-creditcard,hoe verander je de maximum bedrag van een kredietkaart
cards.question.how.change.limit.bankcard-creditcard,hoe wijzig ik de reserve van mijn kredietkaart
cards.question.how.change.limit.bankcard-creditcard,hoe wijzig je de limiet van een krediet kaart
cards.question.how.change.limit.bankcard-creditcard,hoe wijzig je de limiet van een visa kaart
cards.question.how.change.limit.bankcard-creditcard,ik wil weten hoe ik de limiet van de kredietkaart kan veranderen
cards.question.how.change.limit.bankcard-creditcard,ik wil weten hoe ik de limiet van een kredietkaart kan veranderen
cards.question.how.change.limit.bankcard-creditcard,kan je mij tonen hoe ik de limiet van mastercard kan veranderen
cards.question.how.change.limit.bankcard-creditcard,limiet van mijn mastercard prepaid moet anders zijn maar ik weet niet hoe kan je mij helpen
cards.question.how.change.limit.bankcard-creditcard,volgens jou hoe moet ik de bestedingslimiet aanpassen van mijn mastercard
cards.question.how.change.limit.bankcard-creditcard,weet jij hoe limiet van een mastercard platinum wijzigen
cards.question.how.change.limit.bankcard-creditcard,zeg is hoe pas ik de limiet aan van mijn mastercard white prepaid
cards.question.how.check.expenditure_statement.bankcard-creditcard,hoe kan ik de afrekening van mijn krediektaart nagaan
cards.question.how.check.expenditure_statement.bankcard-creditcard,hoe kan ik de afrekening van mijn krediektaart zien
cards.question.how.check.expenditure_statement.bankcard-creditcard,hoe kan ik de afrekening van mijn kredietkaart van februari opvragen
cards.question.how.check.expenditure_statement.bankcard-creditcard,hoe kan ik de afrekening van mijn visa in detail bekijken
cards.question.how.check.expenditure_statement.bankcard-creditcard,Hoe kan ik de historiek van alle verrichtingen van mijn visa zien
cards.question.how.check.expenditure_statement.bankcard-creditcard,hoe kan ik de mastercard afrekening nagaan
cards.question.how.check.expenditure_statement.bankcard-creditcard,hoe kan ik de mastercard uitgavenstaat van februari opvragen
cards.question.how.check.expenditure_statement.bankcard-creditcard,hoe kan ik de uitgavenlijst van de mijn mastercard van de lopende maand zien
cards.question.how.check.expenditure_statement.bankcard-creditcard,hoe kan ik een overzicht van de afnames van mijn kredietkaart zien
cards.question.how.check.expenditure_statement.bankcard-creditcard,hoe kan men de lijst van de uitgaven van mijn mastercard vinden
cards.question.how.check.expenditure_statement.bankcard-creditcard,Hoe krijg ik meer info over een van de lijnen van de vorige afrekening van de visa
cards.question.how.check.expenditure_statement.bankcard-creditcard,hoe nazien alle betalingen mastercard red
cards.question.how.check.expenditure_statement.bankcard-creditcard,hoe vind ik de afrekening terug van mijn kredietkaart
cards.question.how.check.expenditure_statement.bankcard-creditcard,hoe vind ik de afrekening van de mastercard terug
cards.question.how.check.expenditure_statement.bankcard-creditcard,hoe vraag ik het overzicht van mijn uitgaven van mijn visa kaart
cards.question.how.check.expenditure_statement.bankcard-creditcard,hoe zie je de uitgavenstaat van een kredietkaart
cards.question.how.check.expenditure_statement.bankcard-creditcard,Ik wil details zien over de afrekeningen op mijn mastercard hoe moet dat
cards.question.how.check.expenditure_statement.bankcard-creditcard,Ik zou graag alle betalingen willen zien die met mijn Mastercard zijn gedaan maar ik weet niet hoe
cards.question.how.check.expenditure_statement.bankcard-creditcard,kredietkaart afrekening checken hoe doe ik dat
cards.question.how.order.bankcard,een bankkaart aanvragen hoe doe je dat eigenlijk
cards.question.how.order.bankcard,een kaart aanvragen hoe moet dat
cards.question.how.order.bankcard,een vraag over hoe ik een bankkaart bestelling kan plaatsen
cards.question.how.order.bankcard,en hoe vraag ik een kaart aan
cards.question.how.order.bankcard,hoe bekom ik een kaart
cards.question.how.order.bankcard,hoe bestel ik een kaart
cards.question.how.order.bankcard,hoe kan ik een bankkaart aanvragen
cards.question.how.order.bankcard,hoe kan ik een belfius bankkaart bestellen
cards.question.how.order.bankcard,hoe kan ik een kaart aanvragen
cards.question.how.order.bankcard,hoe kan ik mijn kaart aanvragen
cards.question.how.order.bankcard,hoe moet ik een bankkaart aanvragen
cards.question.how.order.bankcard,hoe vervang ik mijn bankkaart
cards.question.how.order.bankcard,hoe vraag ik een bankkaart aan
cards.question.how.order.bankcard,hoe vraag ik een kaart aan
cards.question.how.order.bankcard,ik heb een vraagje over hoe moet ik te werk gaan om een kaart aan te vragen
cards.question.how.order.bankcard,ik heb geen idee hoe ik een kaart kan bestellen kan je mij meer uitleg geven
cards.question.how.order.bankcard,ik zou graag willen weten hoe je een bankkaart aanvraagt
cards.question.how.order.bankcard,kan je mij vertellen wat te doen om zo een bankkaart aanschaffen
cards.question.how.order.bankcard,kan je mij zeggen hoe ik een kaart moet aanvragen
cards.question.how.order.bankcard,wat moet ik doen om een bankkaart te krijgen
cards.question.how.order.bankcard,wat moet ik doen om zo een kaart aanvragen
cards.question.how.order.bankcard-creditcard,hoe bestel ik een mastercard
cards.question.how.order.bankcard-creditcard,hoe kan ik een creditcard aanvragen bij belfius
cards.question.how.order.bankcard-creditcard,hoe kan ik een kredietkaart aanvragen
cards.question.how.order.bankcard-creditcard,hoe kan ik een kredietkaart bestellen
cards.question.how.order.bankcard-creditcard,hoe kredietkaart aanvragen
cards.question.how.order.bankcard-creditcard,hoe krijg ik een kredietkaart
cards.question.how.order.bankcard-creditcard,hoe moet ik doen om een visa te bestellen
cards.question.how.order.bankcard-creditcard,hoe moet ik een gold kredietkaart aanvragen
cards.question.how.order.bankcard-creditcard,hoe verloopt het aanvragen van een kredietkaart
cards.question.how.order.bankcard-creditcard,hoe vraag ik een kredietkaart aan
cards.question.how.order.bankcard-creditcard,hoe vraag ik een mastercard red aan
cards.question.how.order.bankcard-creditcard,ik wil een kredietkaart aanvragen weet jij hoe doe ik dit
cards.question.how.order.bankcard-creditcard,ik wil een kredietkaart wat ik stap voor stap moet doen
cards.question.how.order.bankcard-creditcard,ik wil een kredietkaart wat moet ik daarvoor doen
cards.question.how.order.bankcard-creditcard,ik wil graag een kredietkaart hebben wat moet ik juist doen
cards.question.how.order.bankcard-creditcard,ik zou graag een kredietkaart willen aanvragen maar ik weet niet hoe
cards.question.how.order.bankcard-creditcard,vraagje hoe kan ik een kredietkaart aanvragen
cards.question.how.order.bankcard-creditcard,wat is de procedure om een kredietkaart aan te vragen
cards.question.how.order.bankcard-creditcard,wat moet ik doen om in aanmerking te komen voor een kredietkaart
cards.question.how.order.bankcard-creditcard,wat moet ik doen om zo een prepaid kredietkaart aanvragen
cards.question.how.order.bankcard-digital_channel.creditcard,aanvraag van een white prepaid kredietkaart online hoe verloopt dat
cards.question.how.order.bankcard-digital_channel.creditcard,hoe bestel ik online een mastercard gold
cards.question.how.order.bankcard-digital_channel.creditcard,hoe kan ik een mastercard prepaid white online aanvragen
cards.question.how.order.bankcard-digital_channel.creditcard,hoe kan ik mijn witte prepaid-masterkaart online aanschaffen
cards.question.how.order.bankcard-digital_channel.creditcard,Hoe kan ik online een white prepaid kaart aanvragen
cards.question.how.order.bankcard-digital_channel.creditcard,hoe kredietkaart met de computer aanvragen
cards.question.how.order.bankcard-digital_channel.creditcard,hoe moet ik doen om online een kredietkaart te bestellen
cards.question.how.order.bankcard-digital_channel.creditcard,hoe moet ik doen om via de computer een visa te bestellen
cards.question.how.order.bankcard-digital_channel.creditcard,hoe moet ik een gold kredietkaart aanvragen online
cards.question.how.order.bankcard-digital_channel.creditcard,hoe verloopt het aanvragen van een kredietkaart online
cards.question.how.order.bankcard-digital_channel.creditcard,hoe vraag ik een kredietkaart online aan
cards.question.how.order.bankcard-digital_channel.creditcard,Ik heb een rekening bij jullie maar hoe doe ik om kredietkaart aanvragen online
cards.question.how.order.bankcard-digital_channel.creditcard,ik wil graag een visa hebben wat moet ik juist doen om die online te bestellen
cards.question.how.order.bankcard-digital_channel.creditcard,ik wil online een kredietkaart wat moet ik daarvoor doen
cards.question.how.order.bankcard-digital_channel.creditcard,ik wil online een mastercard classic wat ik stap voor stap moet doen
cards.question.how.order.bankcard-digital_channel.creditcard,ik will een visa online aanvragen maar ik weet niet hoe het moet
cards.question.how.order.bankcard-digital_channel.creditcard,ik zou graag een kredietkaart willen aanvragen met de computer maar ik weet niet hoe
cards.question.how.order.bankcard-digital_channel.creditcard,vraagje hoe kan online ik een visa prepaid aanvragen
cards.question.how.order.extra_card.bankcard-creditcard,binnenkort zal ik een 2e kredietkaart nodig hebben hoe doe ik dit
cards.question.how.order.extra_card.bankcard-creditcard,hoe bestel ik nog een mastercard gold het is voor mijn man
cards.question.how.order.extra_card.bankcard-creditcard,hoe kan ik een 2de mastercard red aanvragen
cards.question.how.order.extra_card.bankcard-creditcard,hoe kan ik een extra kredietkaart bestellen
cards.question.how.order.extra_card.bankcard-creditcard,hoe kan ik een kredietkaart aanvragen boven op mijn andere
cards.question.how.order.extra_card.bankcard-creditcard,hoe kan ik een tweede visa aanvragen
cards.question.how.order.extra_card.bankcard-creditcard,hoe krijg ik een duplicaat van mijn kredietkaart
cards.question.how.order.extra_card.bankcard-creditcard,hoe moet ik doen om een duplicaat mastercard classic aanvragen
cards.question.how.order.extra_card.bankcard-creditcard,hoe vraag ik een tweede visa kaart aan
cards.question.how.order.extra_card.bankcard-creditcard,ik heb een vraag omtrent hoe kan ik een duplicaat kredietkaart bestellen
cards.question.how.order.extra_card.bankcard-creditcard,ik heb reeds een mastercard red hoe kan ik een tweede kaart aanvragen voor mijn partner op dezelfde rekening
cards.question.how.order.extra_card.bankcard-creditcard,ik wil een duplicaat visa is dat mogelijk en hoe kan ik die bestellen
cards.question.how.order.extra_card.bankcard-creditcard,ik wil een duplicaat visa kaart bestellen maar weet niet juist hoe
